201.1;"unit";"single thing";"<P> <U> ADJ. </U> </P> <P> <U> VERB + UNIT </U> </P> ";"<P> <U> ADJ. </U><B> large, small | basic, fundamental </B><I>The family is the basic unit of society. </I><B>| discrete, individual, single </B> </P> <P> <U> VERB + UNIT </U><B> break sth down into, divide sth into </B><I>Large departments were broken down into smaller units. </I> </P> ";"noun"
201.2;"unit";"fixed amount";"<P> <U> ADJ. </U> </P> <P> <U> UNIT + NOUN </U> </P> <P> <U> PREP. </U> </P> <P> <U> PHRASES </U> </P> ";"<P> <U> ADJ. </U><B> basic, standard | monetary | lexical, linguistic </B> </P> <P> <U> UNIT + NOUN </U><B> cost, length, weight </B> </P> <P> <U> PREP. </U><B> ~ of </B><I>a unit of currency a unit of length fifty units of electricity </I> </P> <P> <U> PHRASES </U><B> per unit </B><I>Electricity is ten pence per unit. </I> </P> ";"noun"
201.3;"unit";"group of people";"<P> <U> ADJ. </U> </P> <P> <U> VERB + UNIT </U> </P> ";"<P> <U> ADJ. </U><B> cohesive </B><I>The new manager changed a talented collection of individuals into a cohesive unit. </I><B>| baby, casualty, emergency, intensive care, maternity, psychiatric, surgical, etc. </B><I>She works in the maternity unit at the local hospital. </I><B>| army, enemy, military | intelligence | policy | research | family, social </B><I>the role of the family unit in the community </I> </P> <P> <U> VERB + UNIT </U><B> be attached to </B><I>The cancer research unit is attached to the local university. </I> </P> ";"noun"
201.4;"unit";"piece of furniture/equipment";"<P> <U> ADJ. </U> </P> <P> <U> VERB + UNIT </U> </P> ";"<P> <U> ADJ. </U><B> cooking, kitchen, sink, storage | air-conditioning, control, power, processing, shower </B><I>the central processing unit in a computer </I> </P> <P> <U> VERB + UNIT </U><B> install </B><I>We're having new kitchen units installed. </I> </P>     </script> </div>   </div> <!-- main wrap --> </html> </body> ";"noun"
202;"total";"";"<P> <U> ADJ. </U> </P> <P> <U> VERB + TOTAL </U> </P> <P> <U> TOTAL + VERB </U> </P> <P> <U> PREP. </U> </P> ";"<P> <U> ADJ. </U><B> annual, monthly | combined, cumulative, grand, overall, sum </B><I>His two goals give him a grand total of 32 for the season. The sum total of my knowledge of biology is not impressive. </I><B>| final | high, huge, large, record </B><I>a record total of victories </I><B>| low, small | global, national, world/worldwide | jobless, unemployment </B><I>Britain's jobless total rose by 20,000 last month. </I> </P> <P> <U> VERB + TOTAL </U><B> add up to, give, make (up) </B><I>Their earnings were </I>&pound;</B><I>250, </I>&pound;</B><I>300 and </I>&pound;</B><I>420, giving a total of </I>&pound;</B><I>970. </I><B>| bring, take </B><I>A donation of </I>&pound;</B><I>250 has been received, bringing the total to </I>&pound;</B><I>3,750. </I><B>| achieve </B><I>The Greens achieved a total of 18 seats. </I> </P> <P> <U> TOTAL + VERB </U><B> rise | fall </B> </P> <P> <U> PREP. </U><B> in ~ </B><I>In total, they spent 420 hours on the project. </I><B>| out of a ~ of </B><I>180 vehicles out of a total of 900 examined were not roadworthy. </I><B>| ~ of</B> </P> ";"noun"
203.1;"complex";"";"<P> <U> VERBS </U> </P> <P> <U> ADV. </U> </P> <P> <U> ADJ. </U> </P> <P> <U> VERB + COMPLEX </U> </P> <P> <U> ADJ. </U> </P> <P> <U> VERB + COMPLEX </U> </P> <P> <U> PREP. </U> </P> ";"<P> <U> VERBS </U><B> be, look, seem, sound | become </B> </P> <P> <U> ADV. </U><B> enormously, especially, exceedingly, exceptionally, extraordinarily, extremely, highly, hugely, immensely, incredibly, infinitely, particularly, very </B><I>This is a highly complex matter. </I><B>| increasingly | fairly, quite, rather, relatively, somewhat | surprisingly | unnecessarily | technically </B><I>technically complex surgery </I> </P> ";"adj."
203.2.1;"complex";"set of buildings";"<P> <U> ADJ. </U> </P> <P> <U> VERB + COMPLEX </U> </P> ";"<P> <U> ADJ. </U><B> huge, large, vast | conference, entertainment, factory, holiday, hospital, housing, industrial, leisure, museum, office, shopping, sports </B> </P> <P> <U> VERB + COMPLEX </U><B> build </B> </P> ";"noun"
203.2.2;"complex";"mental/emotional problem";"<P> <U> ADJ. </U> </P> <P> <U> VERB + COMPLEX </U> </P> <P> <U> PREP. </U> </P> ";"<P> <U> ADJ. </U><B> real, terrible | inferiority, superiority | castration, guilt, Oedipus, persecution </B> </P> <P> <U> VERB + COMPLEX </U><B> have, suffer from | develop, get </B><I>Don't keep on at him about his handwriting or he'll get a complex. </I><B>| give sb </B> </P> <P> <U> PREP. </U><B> ~ about </B><I>She has a complex about her big ears. </I> </P> ";"noun"
204.1;"employ";"pay sb to work";"<P> <U> ADV. </U> </P> <P> <U> PREP. </U> </P> <P> <U> PHRASES </U> </P> ";"<P> <U> ADV. </U><B> directly, indirectly </B><I>By 1960 the arms industry in America directly employed 3.5 million people. </I> </P> <P> <U> PREP. </U><B> in </B><I>A large part of the workforce is employed in agriculture. </I> </P> <P> <U> PHRASES </U><B> be fully employed </B><I>10% of 10?15-year-old girls were fully employed as late as 1911. </I><B>| be gainfully employed </B><I>Those not gainfully employed are dependent on their savings. </I><B>| be permanently/temporarily employed, be regularly/irregularly employed </B> </P> ";"verb"
204.2;"employ";"use";"<P> <U> ADV. </U> </P> <P> <U> VERB + EMPLOY </U> </P> ";"<P> <U> ADV. </U><B> commonly, extensively, frequently, often, widely </B><I>The safety net is an image commonly employed in everyday life. </I><B>| generally, usually | actively, deliberately </B><I>teaching that actively employs computers in innovative and fruitful ways </I><B>| successfully, usefully </B> </P> <P> <U> VERB + EMPLOY </U><B> can/could </B><I>The army has far more junior officers than it can usefully employ. </I></P> ";"verb"
204.3;"employ";"be employed: be busy doing sth ";"<P> <U> ADV. </U> </P> <P> <U> PREP. </U> </P> ";"<P> <U> ADV. </U><B> better </B><I>You'd be far better employed taking care of your own affairs. </I><B>| busily, usefully </B> </P> <P> <U> PREP. </U><B> in </B><I>Will and Joe were busily employed in clearing out all the furniture. </I> </P>     </script> </div>   </div> <!-- main wrap --> </html> </body> ";"verb"
205.1;"promote";"encourage sth";"<P> <U> ADV. </U> </P> <P> <U> VERB + PROMOTE </U> </P> <P> <U> PREP. </U> </P> <P> <U> PHRASES </U> </P> ";"<P> <U> ADV. </U><B> strongly </B><I>The idea of equal opportunities was strongly promoted by many Labour MPs. </I><B>| actively, directly | indirectly | deliberately, intentionally </B><I>They claimed that the authorities had deliberately promoted and condoned the violence. </I> </P> <P> <U> VERB + PROMOTE </U><B> aim to, seek to, try to | help (to) </B><I>Basketball stars from the United States have helped promote the sport in Italy and Spain. </I><B>| be designed to </B><I>measures designed to promote economic growth </I><B>| be likely to | serve to, tend to </B><I>Bonus payments to staff serve to promote commitment to the company. </I> </P> <P> <U> PREP. </U><B> through </B><I>Young people's awareness of agricultural issues is promoted through publicity material. </I> </P> <P> <U> PHRASES </U><B> be aimed at promoting sth, be widely promoted, a campaign/scheme to promote sth, efforts/measures to promote sth </B> </P> ";"verb"
205.2;"promote";"advertise sth";"<P> <U> ADV. </U> </P> <P> <U> PREP. </U> </P> ";"<P> <U> ADV. </U><B> aggressively, heavily </B><I>The new products have been very heavily promoted. </I><B>| widely </B> </P> <P> <U> PREP. </U><B> as </B><I>The town is now being promoted as a holiday destination. </I><B>| through </B><I>The company's products have been promoted mainly through advertising in newspapers. </I> </P>     </script> </div>   </div> <!-- main wrap --> </html> </body> ";"verb"
206.1;"literature";"written works of art";"<P> <U> ADJ. </U> </P> <P> <U> QUANT. </U> </P> <P> <U> VERB + LITERATURE </U> </P> ";"<P> <U> ADJ. </U><B> classical, contemporary, modern | great </B> </P> <P> <U> QUANT. </U><B> piece, work </B> </P> <P> <U> VERB + LITERATURE </U><B> read, study </B> </P> ";"noun"
206.2;"literature";"writing on a particular subject";"<P> <U> ADJ. </U> </P> <P> <U> QUANT. </U> </P> <P> <U> PREP. </U> </P> ";"<P> <U> ADJ. </U><B> extensive, voluminous | promotional, sales </B> </P> <P> <U> QUANT. </U><B> body </B><I>the growing body of literature on development issues </I> </P> <P> <U> PREP. </U><B> ~ about </B><I>I picked up some literature about pensions. </I><B>| ~ on </B><I>There's an extensive literature on the subject. </I> </P>     </script> </div>   </div> <!-- main wrap --> </html> </body> ";"noun"
207;"procedure";"";"<P> <U> ADJ. </U> </P> <P> <U> PROCEDURE + NOUN </U> </P> <P> <U> PREP. </U> </P> ";"<P> <U> ADJ. </U><B> complex, complicated | simple, straightforward | correct, normal, proper, standard, usual </B><I>There are standard procedures for dismissing staff. </I><B>| agreed, established | special | administrative, appeals, application, assessment, complaints, court, criminal, disciplinary, emergency, parliamentary, safety, scientific, selection, surgical </B><I>a minor surgical procedure </I> </P> <P> <U> PROCEDURE + NOUN </U><B> adopt, follow, use </B><I>Did you follow the emergency procedure when you heard the alarm? </I><B>| establish </B><I>A straightforward complaints procedure must be established from the outset. </I> </P> <P> <U> PREP. </U><B> under a/the ~ </B><I>under a procedure established by legislation </I><B>| ~ for </B><I>the correct procedure for hiring staff </I> </P> ";"noun"
208;"appropriate";"";"<P> <U> VERBS </U> </P> <P> <U> ADV. </U> </P> <P> <U> PREP. </U> </P> ";"<P> <U> VERBS </U><B> be, seem | consider sth, deem sth, think sth </B><I>It was thought appropriate to award her the prize. </I> </P> <P> <U> ADV. </U><B> extremely, very | entirely, quite </B> </P> <P> <U> PREP. </U><B> for </B><I>It might be appropriate for him to attend the course. </I><B>| to </B><I>Tutors can construct tests appropriate to individual students' needs. </I> </P> ";"adj."
209.1;"estimate";"";"<P> <U> ADJ. </U> </P> <P> <U> VERB + ESTIMATE </U> </P> <P> <U> ESTIMATE + VERB </U> </P> <P> <U> PREP. </U> </P> <P> <U> ADV. </U> </P> <P> <U> VERB + ESTIMATE </U> </P> <P> <U> PREP. </U> </P> ";"<P> <U> ADJ. </U><B> official, unofficial | current, recent </B><I>Current estimates suggest that supplies will run out within six months. </I><B>| early, initial, preliminary | accurate, fair, good, realistic, reasonable, reliable | best </B><I>Flight times in the brochure are based on our best estimate, and will be confirmed as soon as possible. </I><B>| approximate, rough | conservative, low </B><I>I think 15,000 will turn out to be a very low estimate. </I><B>| high </B><I>According to the highest estimate, over 100,000 men died in the battle. </I><B>| optimistic, pessimistic | cost </B> </P> <P> <U> VERB + ESTIMATE </U><B> make </B><I>Can you make an estimate of the numbers involved? </I><B>| give (sb), provide (sb with), submit </B><I>Three firms submitted estimates for the work. </I><B>| revise </B> </P> <P> <U> ESTIMATE + VERB </U><B> be based on sth | indicate sth, predict sth, show sth, suggest sth </B><I>One estimate suggests that 30,000 jobs may be lost. </I><B>| put sth at </B><I>Some estimates put the figure as high as 50%. </I><B>| range, vary </B><I>Cost estimates vary from $50,000 to $200,000. </I> </P> <P> <U> PREP. </U><B> according to an/the ~ </B><I>According to the revised estimate, four million people will be without homes. </I><B>| at an ~ </B><I>Even at a conservative estimate, there is a lot of work to be done. </I><B>| in an/the ~ </B><I>In his first estimate, he suggested a figure of </I>&pound;</B><I>5,000. </I><B>| ~ by, ~ from </B><I>According to an estimate by a leading newspaper, she earns </I>&pound;</B><I>40 million a year. </I><B>| ~ for </B><I>We will send you an estimate for the repairs. </I><B>| ~ of </B><I>an estimate of profits an estimate of </I>&pound;</B><I>300 </I> </P> ";"noun"
209.2;"estimate";"";"<P> <U> ADJ. </U> </P> <P> <U> VERB + ESTIMATE </U> </P> <P> <U> ESTIMATE + VERB </U> </P> <P> <U> PREP. </U> </P> <P> <U> ADV. </U> </P> <P> <U> VERB + ESTIMATE </U> </P> <P> <U> PREP. </U> </P> ";"<P> <U> ADV. </U><B> currently | accurately, reliably | provisionally | conservatively </B><I>It is conservatively estimated that not less than half a million people died in the famine. </I><B>| officially, unofficially </B><I>The strike was officially estimated to have cost $80 million. </I> </P> <P> <U> VERB + ESTIMATE </U><B> be difficult to, be hard to, be impossible to | be used to </B><I>The results of the survey were used to estimate the preferences of the population at large. </I> </P> <P> <U> PREP. </U><B> at </B><I>We estimated the cost at </I>&pound;</B><I>50,000. </I> </P> ";"verb"
210.1.1;"negative";"only thinking about/showing sb/sth's bad qualities";"<P> <U> VERBS </U> </P> <P> <U> ADV. </U> </P> <P> <U> PREP. </U> </P> ";"<P> <U> VERBS </U><B> be, feel, seem, sound | become | remain </B> </P> <P> <U> ADV. </U><B> distinctly, extremely, strongly, terribly, very </B><I>the strongly negative implications of these survey results Their attitude was terribly negative. </I><B>| completely, entirely, exclusively, purely, totally, wholly </B><I>She spoke in entirely negative terms. </I><B>| largely, mainly, overwhelmingly | fairly, rather, slightly, somewhat | apparently | essentially </B><I>Critical thinking is essentially negative as it seeks to dissect and not to build. </I><B>| generally </B> </P> <P> <U> PREP. </U><B> about </B><I>He's been rather negative about the idea. </I> </P> ";"adj."
210.1.2;"negative";"showing that sth has not happened/been found";"<P> <U> VERBS </U> </P> <P> <U> PREP. </U> </P> ";"<P> <U> VERBS </U><B> be, prove, test </B><I>The breathalyser test proved negative. He tested negative for HIV infection. </I> </P> <P> <U> PREP. </U><B> for </B><I>The urine tests were negative for protein. </I> </P> ";"adj."
210.2.1;"negative";"denial";"<P> <U> VERB + NEGATIVE </U> </P> ";"<P> <U> VERB + NEGATIVE </U><B> answer (sth) in, reply in </B><I>She answered the question in the negative. </I> </P> ";"noun"
210.2.2;"negative";"developed photographic film";"<P> <U> ADJ. </U> </P> <P> <U> QUANT. </U> </P> <P> <U> VERB + NEGATIVE </U> </P> ";"<P> <U> ADJ. </U><B> original | photographic | film, glass </B> </P> <P> <U> QUANT. </U><B> strip </B> </P> <P> <U> VERB + NEGATIVE </U><B> produce | develop </B><I>His interest in photography started with him developing negatives that he found lying around the house. </I><B>| keep </B><I>We must assume that the spy kept the negatives. </I><B>| destroy</B> </P> ";"noun"
211.1;"characteristic";"";"<P> <U> VERBS </U> </P> <P> <U> ADV. </U> </P> <P> <U> PREP. </U> </P> <P> <U> ADJ. </U> </P> <P> <U> VERB + CHARACTERISTIC </U> </P> ";"<P> <U> VERBS </U><B> be | become </B> </P> <P> <U> ADV. </U><B> deeply, extremely, highly, very </B><I>his highly characteristic features </I><B>| entirely, utterly | fairly, quite </B> </P> <P> <U> PREP. </U><B> of </B><I>a problem that was fairly characteristic of late eighteenth century society </I> </P> ";"adj."
211.2;"characteristic";"";"<P> <U> VERBS </U> </P> <P> <U> ADV. </U> </P> <P> <U> PREP. </U> </P> <P> <U> ADJ. </U> </P> <P> <U> VERB + CHARACTERISTIC </U> </P> ";"<P> <U> ADJ. </U><B> defining, distinctive, distinguishing, identifying, individual, marked, special, striking, unique | personal | common, family, inherited, national, shared | basic, general | chief, dominant, main, major, outstanding, principal | essential, fundamental, important, key, salient | desirable | behavioural, biological, cultural, demographic, economic, genetic, physical, psychological, racial, sexual, social | human </B> </P> <P> <U> VERB + CHARACTERISTIC </U><B> have </B><I>The two species have several characteristics in common. </I> </P> ";"noun"
212;"typically";"";"";"";""
213.1.1;"challenge";"sth new and difficult
question whether sth is right/true";"<P> <U> ADJ. </U> </P> <P> <U> VERB + CHALLENGE </U> </P> <P> <U> CHALLENGE + VERB </U> </P> <P> <U> ADV. </U> </P> <P> <U> PREP. </U> </P> ";"<P> <U> ADJ. </U><B> big, considerable, enormous, great, huge, radical, real, serious, significant, strong | difficult, tough | major, main | fresh, new | exciting, interesting | economic, environmental, intellectual, political, technical, technological </B><I>Liszt's piano music presents an enormous technical challenge. </I> </P> <P> <U> VERB + CHALLENGE </U><B> be, pose, present | face, meet, respond to, rise to, take on/up </B><I>The gallery has risen to the challenge of exhibiting the works of young artists. He has taken on some exciting new challenges with this job. </I> </P> <P> <U> CHALLENGE + VERB </U><B> face sb </B><I>the challenges facing nurses in casualty </I> </P> <P> <U> ADV. </U><B> directly </B><I>The newspaper was directly challenging the government's legitimacy. </I><B>| seriously | effectively </B><I>She was effectively challenging the whole basis on which society was run. </I><B>| successfully </B><I>The story was completely untrue and was successfully challenged in court. </I> </P> <P> <U> PREP. </U><B> on </B><I>She challenged him on his old-fashioned views. </I> </P> ";"noun"
213.1.2;"challenge";"that shows that sb refuses to accept sth
invite sb to compete, argue, etc.";"<P> <U> ADJ. </U> </P> <P> <U> VERB + CHALLENGE </U> </P> <P> <U> PREP. </U> </P> <P> <U> ADV. </U> </P> <P> <U> PREP. </U> </P> ";"<P> <U> ADJ. </U><B> serious | direct | effective | legal </B> </P> <P> <U> VERB + CHALLENGE </U><B> be, present, represent </B><I>The demonstration represents a direct challenge to the new law. </I> </P> <P> <U> PREP. </U><B> ~ to </B><I>a legal challenge to the president's power </I> </P> <P> <U> ADV. </U><B> seriously </B><I>No one has seriously challenged the champion. </I><B>| successfully, unsuccessfully </B> </P> <P> <U> PREP. </U><B> for </B><I>She was poised to challenge for the party leadership. </I><B>| to </B><I>The count challenged him to a duel. </I> </P>     </script> </div>   </div> <!-- main wrap --> </html> </body> ";"noun"
213.1.3;"challenge";"invitation to compete";"<P> <U> ADJ. </U> </P> <P> <U> VERB + CHALLENGE </U> </P> <P> <U> PREP. </U> </P> <P> <U> ADJ. </U> </P> <P> <U> VERB + CHALLENGER </U> </P> <P> <U> PREP. </U> </P> <P> <U> ADV. </U> </P> <P> <U> PREP. </U> </P> <P> <U> ADV. </U> </P> <P> <U> PREP. </U> </P> ";"<P> <U> ADJ. </U><B> leadership, title </B><I>his title challenge to the heavyweight champion </I> </P> <P> <U> VERB + CHALLENGE </U><B> issue, mount </B><I>plans to mount a leadership challenge within the party </I><B>| accept, take up </B><I>I accepted his challenge to a game of chess. </I><B>| beat off, fight off </B><I>Our team will have to fight off the challenge from better trained teams. </I> </P> <P> <U> PREP. </U><B> ~ from </B><I>a challenge from the other political party </I> </P> </DIV><DIV class="item"><P class="word"><B>challenger </B><I>noun </I> </P> <P> <U> ADJ. </U><B> closest, main, nearest, serious, strong </B><I>Her nearest challenger is the vice-president. </I> </P> <P> <U> VERB + CHALLENGER </U><B> take on </B><I>He took on various challengers, but refused to fight Jackson. </I> </P> <P> <U> PREP. </U><B> ~ for </B><I>the main challengers for the European title </I><B>| ~ to </B><I>a challenger to the prime minister </I> </P> </DIV><DIV class="item"><P class="word"><B>challenge </B><I>verb </I> </P> <P> <SUP> 1 </SUP> <TT> question whether sth is right/true </TT> </P> <P> <U> ADV. </U><B> directly </B><I>The newspaper was directly challenging the government's legitimacy. </I><B>| seriously | effectively </B><I>She was effectively challenging the whole basis on which society was run. </I><B>| successfully </B><I>The story was completely untrue and was successfully challenged in court. </I> </P> <P> <U> PREP. </U><B> on </B><I>She challenged him on his old-fashioned views. </I> </P> <P> <SUP> 2 </SUP> <TT> invite sb to compete, argue, etc. </TT> </P> <P> <U> ADV. </U><B> seriously </B><I>No one has seriously challenged the champion. </I><B>| successfully, unsuccessfully </B> </P> <P> <U> PREP. </U><B> for </B><I>She was poised to challenge for the party leadership. </I><B>| to </B><I>The count challenged him to a duel. </I> </P>     </script> </div>   </div> <!-- main wrap --> </html> </body> ";"noun"
213.1.4;"challenge";"";"";"";"noun"
213.1.5;"challenge";"";"";"";"noun"
213.2.1;"challenge";"sth new and difficult";"<P> <U> ADJ. </U> </P> <P> <U> VERB + CHALLENGE </U> </P> <P> <U> CHALLENGE + VERB </U> </P> ";"<P> <U> ADJ. </U><B> big, considerable, enormous, great, huge, radical, real, serious, significant, strong | difficult, tough | major, main | fresh, new | exciting, interesting | economic, environmental, intellectual, political, technical, technological </B><I>Liszt's piano music presents an enormous technical challenge. </I> </P> <P> <U> VERB + CHALLENGE </U><B> be, pose, present | face, meet, respond to, rise to, take on/up </B><I>The gallery has risen to the challenge of exhibiting the works of young artists. He has taken on some exciting new challenges with this job. </I> </P> <P> <U> CHALLENGE + VERB </U><B> face sb </B><I>the challenges facing nurses in casualty </I> </P> ";"noun"
213.2.2;"challenge";"that shows that sb refuses to accept sth";"<P> <U> ADJ. </U> </P> <P> <U> VERB + CHALLENGE </U> </P> <P> <U> PREP. </U> </P> ";"<P> <U> ADJ. </U><B> serious | direct | effective | legal </B> </P> <P> <U> VERB + CHALLENGE </U><B> be, present, represent </B><I>The demonstration represents a direct challenge to the new law. </I> </P> <P> <U> PREP. </U><B> ~ to </B><I>a legal challenge to the president's power </I> </P> ";"noun"
213.2.3;"challenge";"invitation to compete";"<P> <U> ADJ. </U> </P> <P> <U> VERB + CHALLENGE </U> </P> <P> <U> PREP. </U> </P> <P> <U> ADJ. </U> </P> <P> <U> VERB + CHALLENGER </U> </P> <P> <U> PREP. </U> </P> ";"<P> <U> ADJ. </U><B> leadership, title </B><I>his title challenge to the heavyweight champion </I> </P> <P> <U> VERB + CHALLENGE </U><B> issue, mount </B><I>plans to mount a leadership challenge within the party </I><B>| accept, take up </B><I>I accepted his challenge to a game of chess. </I><B>| beat off, fight off </B><I>Our team will have to fight off the challenge from better trained teams. </I> </P> <P> <U> PREP. </U><B> ~ from </B><I>a challenge from the other political party </I> </P> </DIV><DIV class="item"><P class="word"><B>challenger </B><I>noun </I> </P> <P> <U> ADJ. </U><B> closest, main, nearest, serious, strong </B><I>Her nearest challenger is the vice-president. </I> </P> <P> <U> VERB + CHALLENGER </U><B> take on </B><I>He took on various challengers, but refused to fight Jackson. </I> </P> <P> <U> PREP. </U><B> ~ for </B><I>the main challengers for the European title </I><B>| ~ to </B><I>a challenger to the prime minister </I> </P> ";"noun"
213.3.1;"challenge";"question whether sth is right/true";"<P> <U> ADV. </U> </P> <P> <U> PREP. </U> </P> ";"<P> <U> ADV. </U><B> directly </B><I>The newspaper was directly challenging the government's legitimacy. </I><B>| seriously | effectively </B><I>She was effectively challenging the whole basis on which society was run. </I><B>| successfully </B><I>The story was completely untrue and was successfully challenged in court. </I> </P> <P> <U> PREP. </U><B> on </B><I>She challenged him on his old-fashioned views. </I> </P> ";"verb"
213.3.2;"challenge";"invite sb to compete, argue, etc.";"<P> <U> ADV. </U> </P> <P> <U> PREP. </U> </P> ";"<P> <U> ADV. </U><B> seriously </B><I>No one has seriously challenged the champion. </I><B>| successfully, unsuccessfully </B> </P> <P> <U> PREP. </U><B> for </B><I>She was poised to challenge for the party leadership. </I><B>| to </B><I>The count challenged him to a duel. </I> </P> ";"verb"
214.1;"principle";"basic general rule";"<P> <U> ADJ. </U> </P> <P> <U> VERB + PRINCIPLE </U> </P> <P> <U> PRINCIPLE + VERB </U> </P> <P> <U> PREP. </U> </P> ";"<P> <U> ADJ. </U><B> basic, broad, central, fundamental, general </B><I>the basic principles of car maintenance </I><B>| cardinal, essential, key | universal | democratic, legal, market, political, scientific, theoretical </B> </P> <P> <U> VERB + PRINCIPLE </U><B> establish, formulate, lay down | apply | explain </B> </P> <P> <U> PRINCIPLE + VERB </U><B> apply </B><I>This principle applies to all kinds of selling. </I><B>| underlie sth, underpin sth </B><I>the principles underlying Western philosophy </I> </P> <P> <U> PREP. </U><B> in ~ </B><I>I agree with you in principle, but we'll need to discuss the details. </I><B>| ~ behind </B><I>She went on to explain the principles behind what she was doing. </I> </P> ";"noun"
214.2;"principle";"rule for good behaviour";"<P> <U> ADJ. </U> </P> <P> <U> VERB + PRINCIPLE </U> </P> <P> <U> PREP. </U> </P> <P> <U> PHRASES </U> </P> ";"<P> <U> ADJ. </U><B> high | guiding | Christian | moral </B><I>He was a man of high moral principles. </I> </P> <P> <U> VERB + PRINCIPLE </U><B> betray, compromise </B><I>I refuse to compromise my principles by eating meat. </I><B>| adhere to, stick to </B><I>She sticks to the principle that everyone should be treated equally. </I> </P> <P> <U> PREP. </U><B> against your ~s </B><I>Eating meat was against her principles. </I><B>| on ~ </B><I>She's opposed to abortion on principle. </I> </P> <P> <U> PHRASES </U><B> a matter of principle </B><I>They reject the proposal as a matter of principle. </I><B>| a person of principle </B>(= a person with high moral standards)  </P>     </script> </div>   </div> <!-- main wrap --> </html> </body> ";"noun"
