336.1.2;"account";"arrangement with a bank";"<P> <U> ADJ. </U> </P> <P> <U> VERB + ACCOUNT </U> </P> <P> <U> PREP. </U> </P> ";"<P> <U> ADJ. </U><B> bank, building society | current | deposit, investment, savings | personal | business | joint, separate </B><I>My husband and I have separate accounts. </I><B>| numbered </B><I>They have a numbered account in Switzerland. </I> </P> <P> <U> VERB + ACCOUNT </U><B> have, hold </B><I>Go and see the manager of the bank where your account is held. </I><B>| open </B><I>She opened a savings account at the building society. </I><B>| close | credit sth to, pay/put sth into </B><I>The money will be credited to your account tomorrow. </I><B>| debit (sth from), draw sth out (of), pay sth from, take sth out (of), withdraw sth (from) </B><I>She had taken all her money out of her account. </I><B>| overdraw </B><I>Your account is overdrawn. </I> </P> <P> <U> PREP. </U><B> ~ at </B><I>He opened an account at a bank in Germany. </I><B>| ~ with </B><I>an account with Barclays Bank </I> </P> ";"noun"
336.1.3;"account";"accounts: record of money a business earns/spends ";"<P> <U> VERB + ACCOUNT </U> </P> <P> <U> ACCOUNT + VERB </U> </P> ";"<P> <U> VERB + ACCOUNT </U><B> do, keep </B><I>Try to keep accurate accounts. </I><B>| audit, check, look at | submit </B><I>Your accounts will need to be submitted to the tax office. </I> </P> <P> <U> ACCOUNT + VERB </U><B> be in order </B><I>The accounts are all in order. </I> &gt; Special page at BUSINESS </B> </P> ";"noun"
336.1.4;"account";"arrangement with a shop/business";"<P> <U> ADJ. </U> </P> <P> <U> VERB + ACCOUNT </U> </P> <P> <U> PREP. </U> </P> <P> <U> ADV. </U> </P> ";"<P> <U> ADJ. </U><B> expense </B>(= an arrangement to charge expenses to your own employers) <I>taking clients for expense account lunches </I> </P> <P> <U> VERB + ACCOUNT </U><B> have | open </B><I>I'd like to open an account, please. </I><B>| close | pay off, settle </B><I>It is best to settle the account each month. </I> | charge sth to, debit (sth from), put sth on </B><I>Charge this to my account, please. </I><B>| credit sth to </B> </P> <P> <U> PREP. </U><B> on ~ </B><I>Ring for a cab on account. </I><B>| ~ at/with </B><I>an account with a large store </I> </P> </DIV><DIV class="item"><P class="word"><B>account </B><I>verb </I><B>PHRASAL VERBS account for sth </B> </P> <P> <U> ADV. </U><B> fully </B><I>The increase can be fully accounted for. </I><B>| partly </B><I>The differences in achievement between the pupils are partly accounted for by differences in age. </I> </P>     </script> </div>   </div> <!-- main wrap --> </html> </body> ";"noun"
336.2;"account";"";"<P> <U> ADJ. </U> </P> <P> <U> VERB + ACCOUNT </U> </P> <P> <U> PREP. </U> </P> <P> <U> PHRASES </U> </P> <P> <U> ADJ. </U> </P> <P> <U> VERB + ACCOUNT </U> </P> <P> <U> PREP. </U> </P> <P> <U> VERB + ACCOUNT </U> </P> <P> <U> ACCOUNT + VERB </U> </P> <P> <U> ADJ. </U> </P> <P> <U> VERB + ACCOUNT </U> </P> <P> <U> PREP. </U> </P> <P> <U> ADV. </U> </P> ";"";"</DIV><DIV class="item"><P class="word"><B>account </B><I>verb </I><B>PHRASAL VERBS account for sth </B> </P>"
337;"statistics";"";"<P> <U> ADJ. </U> </P> <P> <U> VERB + STATISTICS </U> </P> <P> <U> STATISTICS + VERB </U> </P> <P> <U> STATISTICS + NOUN </U> </P> <P> <U> PREP. </U> </P> ";"<P> <U> ADJ. </U><B> annual, monthly | latest | reliable | vital | bald, raw </B><I>The bald statistics tell us nothing about the underlying trends. </I><B>| government, national, official, police | accident, crime, criminal, economic, health, population, transport, unemployment, etc. </B> </P> <P> <U> VERB + STATISTICS </U><B> prepare, produce | keep </B><I>We no longer keep statistics on former employees. </I><B>| release </B> </P> <P> <U> STATISTICS + VERB </U><B> indicate sth, prove sth, reveal sth, show sth, tell sb sth | suggest sth </B> </P> <P> <U> STATISTICS + NOUN </U><B> office </B> </P> <P> <U> PREP. </U><B> according to ~ </B><I>According to official statistics, the island had 37 inhabitants. </I><B>| ~ on </B><I>The government has released new statistics on the cost of living. </I> ";"noun"
338;"theme";"";"<P> <U> ADJ. </U> </P> <P> <U> VERB + THEME </U> </P> <P> <U> THEME + VERB </U> </P> <P> <U> THEME + NOUN </U> </P> <P> <U> PREP. </U> </P> <P> <U> PHRASES </U> </P> ";"<P> <U> ADJ. </U><B> basic, central, dominant, important, key, main, major, underlying | broad, general | common, popular, universal </B><I>universal themes of love and loneliness </I><B>| constant, familiar, favourite, recurrent, recurring | related | unifying | contemporary, topical | historical, religious, etc. | campaign, conference, research | musical </B><I>The film's haunting musical theme stayed in my head for days. </I> </P> <P> <U> VERB + THEME </U><B> develop, discuss, examine, explore </B><I>His later novels develop the theme of alienation. </I><B>| warm to </B><I>&lsquo;Our work&rsquo;, he continued, warming to his theme, &lsquo;will be a milestone in scientific history.&rsquo; </I> </P> <P> <U> THEME + VERB </U><B> emerge </B><I>Several familiar themes emerged from the discussion. </I><B>| run through sth </B><I>The same themes run through all her novels. </I> </P> <P> <U> THEME + NOUN </U><B> music, song, tune | park, pub </B> </P> <P> <U> PREP. </U><B> on the ~ of </B><I>He gave a talk on the theme of teenage unemployment. </I> </P> <P> <U> PHRASES </U><B> variations on a theme </B><I>Most of the essays appear to be variations on a few central themes. </I> </P> ";"noun"
339.1;"locate";"find the position of sb/sth";"<P> <U> ADV. </U> </P> <P> <U> VERB + LOCATE </U> </P> <P> <U> ADV. </U> </P> <P> <U> PREP. </U> </P> ";"<P> <U> ADV. </U><B> accurately, precisely </B><I>The machine can accurately locate radioactive material. </I><B>| quickly | easily </B> </P> <P> <U> VERB + LOCATE </U><B> be able/unable to, can/could </B><I>We haven't yet been able to locate a suitable site. </I><B>| try to | fail to | be easy to </B><I>Some stars are quite easy to locate with a telescope. </I><B>| be difficult to 2 be located </B>be in a place </B> </P> <P> <U> ADV. </U><B> centrally </B><I>The hotel is centrally located between Dam Square and Central Station. </I><B>| conveniently, ideally, strategically | physically </B><I>Two people can meet in virtual reality even if physically located in different continents. </I><B>| abroad </B> </P> <P> <U> PREP. </U><B> at, between, close to, in, on, near, outside, within, etc. </B><I>Your accommodation is conveniently located within walking distance of the town centre. </I> </P>     </script> </div>   </div> <!-- main wrap --> </html> </body> ";"verb"
340;"adequate";"";"<P> <U> VERBS </U> </P> <P> <U> ADV. </U> </P> <P> <U> PREP. </U> </P> ";"<P> <U> VERBS </U><B> be, prove, seem | remain | consider sth, think sth </B><I>The trains were not considered adequate for use on the modern railways. </I> </P> <P> <U> ADV. </U><B> really, very | perfectly, quite, totally | more than </B><I>The system is more than adequate to deal with any problems. </I><B>| barely, hardly, less than, not entirely, not wholly </B><I>The grants given to students are less than adequate. </I><B>| more or less </B><I>The amount of money we have been given is more or less adequate. </I><B>| still | no longer </B> </P> <P> <U> PREP. </U><B> for </B><I>The old computer is still perfectly adequate for most tasks. </I> </P> ";"adj."
341;"largely";"";"";"";""
342.1;"ideal";"";"<P> <U> VERBS </U> </P> <P> <U> ADV. </U> </P> <P> <U> PREP. </U> </P> <P> <U> ADJ. </U> </P> <P> <U> VERB + IDEAL </U> </P> ";"<P> <U> VERBS </U><B> be, look, seem, sound | make sth </B><I>The hotel's size makes it ideal for large conferences. </I><B>| consider sth </B> </P> <P> <U> ADV. </U><B> absolutely | almost | less than </B><I>Language learning often takes place in a less than ideal environment. </I> </P> <P> <U> PREP. </U><B> for </B><I>The houses are absolutely ideal for families with young children. </I> </P> ";"adj."
342.2;"ideal";"";"<P> <U> VERBS </U> </P> <P> <U> ADV. </U> </P> <P> <U> PREP. </U> </P> <P> <U> ADJ. </U> </P> <P> <U> VERB + IDEAL </U> </P> ";"<P> <U> ADJ. </U><B> high, lofty, noble </B><I>Sam was a real leader who had high moral ideals. </I><B>| unattainable </B><I>This is not an unattainable ideal. </I><B>| aesthetic, artistic, ethical, moral, political | democratic, liberal, revolutionary, socialist </B> </P> <P> <U> VERB + IDEAL </U><B> be committed to, be devoted to, believe in, cling to, espouse, have, support </B><I>They still clung to the old ideals. </I><B>| pursue, strive for | achieve, attain, be true to, conform to, live up to </B><I>A journalist should always live up to the ideals of truth, decency, and justice. </I><B>| fall short of </B><I>This agreement falls far short of the ideal. </I><B>| abandon, betray </B><I>She was accused of betraying her political ideals. </I><B>| embody, reflect </B><I>the democratic ideals embodied in the charter </I> </P> ";"noun"
343.1;"philosophy";"study of ideas about the meaning of life";"<P> <U> ADJ. </U> </P> <P> <U> PHRASES </U> </P> ";"<P> <U> ADJ. </U><B> ancient, classical | contemporary, modern | Eastern, Western | experimental, moral, natural </B><I>(historical)</I>, <B>political, religious, social </B> </P> <P> <U> PHRASES </U><B> the philosophy of history/religion/science </B> <br><a href="#" class="show_hide" id="plus">More information about SUBJECT</a>  <DIV class="slidingDiv"> <a><I>SUBJECT:</I></a>  <P><B>of study do, read, study ~ do ~ </B>is more commonly used with school subjects (but may also be used with university subjects): <I>She did maths, physics and chemistry at school. </I></P> <P><B>study ~ </B>is used with both school and university subjects: <I>He studied German at school. She went on to study mathematics at university. </I></P> <P><B>read ~</B>is only used with university subjects and is quite formal: <I>She was educated privately and at Pembroke College, where she read classics. </I></P> <P><B>lecture in, teach ~ </B><I>He taught music at a school in Edinburgh. </I></P> <P>Other verbs used with <I>subject</I> can also be used with particular subjects of study: <I>Half the students take geography at A level. We offer accounting as a subsidiary course. </I></P> <P><B>~ degree, a degree/diploma in ~ </B><I>a law degree a higher diploma in fine art </I></P> <P><B>~ class, course, lecture, lesson </B><I>The genetics lectures are on a different campus. </I></P> <P><B>~ department, a/the department of ~ </B><I>All enquiries should be made to the Department of Architecture. </I></P> <P><B>~ graduate, student, undergraduate </B><I>Some architecture graduates gain further qualifications in specialist fields. </I></P> <P><B>~ lecturer, teacher, tutor </B><I>He's an English teacher at Highland Road School. </I></P> <P><B>~ professor, (a) professor of ~ </B><I>She's professor of linguistics at the University of Wales. </I></P> <P><B>the study of ~ </B><I>The study of philosophy helps you to think critically. </I></P> <P><B>in ~ </B><I>He got As in history and art. </I></P> <P></P> </DIV>   </P> ";"noun"
343.2;"philosophy";"particular system of beliefs";"<P> <U> ADJ. </U> </P> <P> <U> VERB + PHILOSOPHY </U> </P> <P> <U> PHILOSOPHY + VERB </U> </P> <P> <U> PREP. </U> </P> <P> <U> PHRASES </U> </P> ";"<P> <U> ADJ. </U><B> competing, differing | prevailing </B><I>humanism?the prevailing philosophy today in the Western world </I><B>| basic, general, underlying | personal | homespun, simple </B><I>the homespun philosophy that kept her going during this difficult period </I><B>| liberal | design, economic, educational, management, market, political, religious, social </B><I>a furniture-maker's design philosophy </I> </P> <P> <U> VERB + PHILOSOPHY </U><B> develop, formulate </B><I>developing a personal philosophy </I><B>| articulate | adopt, embrace, espouse | reject </B> </P> <P> <U> PHILOSOPHY + VERB </U><B> inform sth, underlie sth, underpin sth </B><I>the philosophy underlying the education system </I><B>| prevail </B><I>the management philosophy which prevailed at that time </I> </P> <P> <U> PREP. </U><B> ~ behind </B><I>The new measures were introduced with no explanation of the philosophy behind them. </I> </P> <P> <U> PHRASES </U><B> a philosophy of life/mind</B> </P>     </script> </div>   </div> <!-- main wrap --> </html> </body> ";"noun"
344;"minority";"";"<P> <U> ADJ. </U> </P> <P> <U> VERB + MINORITY </U> </P> <P> <U> MINORITY + NOUN </U> </P> <P> <U> PREP. </U> </P> <P> <U> PHRASES </U> </P> ";"<P> <U> ADJ. </U><B> large, significant, sizeable, substantial | small, tiny | vociferous </B><I>the view of a small but vociferous minority </I><B>| ethnic, national, racial, religious | oppressed, persecuted </B> </P> <P> <U> VERB + MINORITY </U><B> belong to | discriminate against </B> </P> <P> <U> MINORITY + NOUN </U><B> opinion, view | community, group | government </B> </P> <P> <U> PREP. </U><B> among a/the ~ </B><I>You are definitely among the minority. </I><B>| from a/the~ </B><I>people from ethnic minorities </I><B>| in a/the ~ </B><I>We are in the minority on this issue. </I><B>| ~ of </B><I>a sizeable minority of the population </I> </P> <P> <U> PHRASES </U><B> only a minority </B><I>Only a tiny minority of holidays are affected. </I> </P> ";"noun"
345;"hypothesis";"";"<P> <U> ADJ. </U> </P> <P> <U> VERB + HYPOTHESIS </U> </P> <P> <U> VERB + HYPOTHESIS </U> </P> <P> <U> PREP. </U> </P> ";"<P> <U> ADJ. </U><B> acceptable, plausible | bold </B><I>Scientists have proposed a bold hypothesis. </I><B>| unlikely | speculative | testable | working </B><I>These observations appear to support our working hypothesis. </I><B>| scientific </B> </P> <P> <U> VERB + HYPOTHESIS </U><B> construct, form, formulate, have, make, propose, put forward, suggest </B><I>It is possible to make a hypothesis on the basis of this graph. A number of hypotheses have been put forward. </I><B>| consider, discuss, examine, test (out) </B><I>using this data to test her hypothesis </I><B>| confirm, prove, support | accept | reject </B><I>None of the hypotheses can be rejected at this stage. </I> </P> <P> <U> VERB + HYPOTHESIS </U><B> concern sth </B><I>Her hypothesis concerns the role of electromagnetic radiation. </I><B>| predict sth </B><I>The hypothesis predicts that children will perform better on task A than on task B. </I> </P> <P> <U> PREP. </U><B> on a/the ~ </B><I>Her study is based on the hypothesis that language simplification is possible. </I><B>| ~ about </B><I>an interesting hypothesis about the development of language </I><B>| ~ on </B><I>The results confirmed his hypothesis on the use of modal verbs. </I> </P> ";"noun"
346;"psychological";"";"<P> <U> VERBS </U> </P> <P> <U> ADV. </U> </P> ";"<P> <U> VERBS </U><B> be </B> </P> <P> <U> ADV. </U><B> purely </B><I>The symptoms are purely psychological. </I> </P> ";"adj."
347;"enable";"";"";"";""
348;"trend";"";"<P> <U> ADJ. </U> </P> <P> <U> VERB + TREND </U> </P> <P> <U> TREND + VERB </U> </P> <P> <U> PREP. </U> </P> ";"<P> <U> ADJ. </U><B> strong | consistent, constant, steady | accelerating, growing, increasing | underlying </B><I>Despite this month's disappointing figures, the underlying trend is healthy. </I><B>| dominant, main, major, prevailing | gradual | clear, marked | general | apparent, discernible | global, national, international, universal, worldwide | wider </B><I>The increase in crime in London was just part of a wider trend. </I><B>| positive, upward | downward, negative | contrary, opposite | healthy, welcome | adverse, dangerous, disturbing, unfortunate, worrying | fashion | demographic, population | cultural, social | evolutionary, historical | economic, market | growth, inflationary </B><I>The latest figures show a clear growth trend in the service sector. </I> </P> <P> <U> VERB + TREND </U><B> begin, create, set, start </B><I>In the 1960s, Britain set the fashion trends. </I><B>| continue | follow </B><I>We are following the American trend towards more flexible working conditions. </I><B>| reinforce | buck, counteract, go against </B><I>efforts to buck the current downward trend in sales </I><B>| reverse | halt | detect, notice | indicate, reflect, show, suggest </B><I>The data indicates a trend towards earlier retirement. </I> </P> <P> <U> TREND + VERB </U><B> develop, emerge | continue | indicate sth, reflect sth, suggest sth </B><I>Current trends suggest that car traffic will continue to grow. </I><B>| grow </B> </P> <P> <U> PREP. </U><B> ~ away from </B><I>a trend away from narrow specialization </I><B>| ~ for </B><I>A trend for romance and nostalgia has emerged. </I><B>| ~ in </B><I>future trends in the volume of employment </I><B>| ~ towards </B><I>the trend towards privatization </I> </P> ";"noun"
349.1;"exchange";"giving/receiving sth in return for sth else";"<P> <U> ADJ. </U> </P> <P> <U> PREP. </U> </P> ";"<P> <U> ADJ. </U><B> fair | mutual, two-way </B><I>We get together once a month for a mutual exchange of ideas. </I> </P> <P> <U> PREP. </U><B> in ~ (for) </B><I>Woollen cloth and timber were sent to Egypt in exchange for linen or papyrus. </I><B>| ~ between </B><I>There were exchanges of goods between the two regions. </I><B>| ~ for </B><I>She considered free language lessons a fair exchange for free accommodation. </I> </P> ";"noun"
349.2;"exchange";"angry conversation/argument";"<P> <U> ADJ. </U> </P> <P> <U> PREP. </U> </P> <P> <U> PHRASES </U> </P> ";"<P> <U> ADJ. </U><B> brief | acrimonious, angry, bitter, heated, sharp | verbal </B><I>a bitter verbal exchange </I> </P> <P> <U> PREP. </U><B> ~ about </B><I>angry exchanges about the problem of unemployment </I><B>| ~ between </B><I>There were many acrimonious exchanges between the two men. </I><B>| ~ with </B><I>Opposition MPs were involved in heated exchanges with the prime minister. </I> </P> <P> <U> PHRASES </U><B> an exchange of views </B><I>She had a full and frank exchange of views with her boss before resigning. </I> </P> ";"noun"
349.3;"exchange";"of foreign currencies";"<P> <U> EXCHANGE + NOUN </U> </P> ";"<P> <U> EXCHANGE + NOUN </U><B> rate </B> </P> ";"noun"
349.4;"exchange";"visit";"<P> <U> ADJ. </U> </P> <P> <U> VERB + EXCHANGE </U> </P> <P> <U> PREP. </U> </P> ";"<P> <U> ADJ. </U><B> academic, cultural | student, youth | official </B> </P> <P> <U> VERB + EXCHANGE </U><B> go on </B> </P> <P> <U> PREP. </U><B> on an/the ~ </B><I>She is in France on a student exchange. </I><B>| ~ to </B><I>He's gone on an exchange to Rome. </I><B>| ~ with </B><I>an exchange with a German student </I> </P>     </script> </div>   </div> <!-- main wrap --> </html> </body> ";"noun"
350;"percentage";"";"<P> <U> ADJ. </U> </P> <P> <U> VERB + PERCENTAGE </U> </P> <P> <U> PERCENTAGE + NOUN </U> </P> <P> <U> PREP. </U> </P> <P> <U> PHRASES </U> </P> ";"<P> <U> ADJ. </U><B> high, large </B><I>The area has a high percentage of unemployed men. </I><B>| low, small </B> </P> <P> <U> VERB + PERCENTAGE </U><B> calculate | express sth as </B><I>This figure can be expressed as a percentage of the total. </I> </P> <P> <U> PERCENTAGE + NOUN </U><B> point </B><I>Unemployment has fallen by two percentage points this month. </I><B>| rate </B><I>Insurance contributions are paid at a fixed percentage rate on all earnings. </I><B>| figure | increase, rise </B><I>the percentage rise in the average salary </I><B>| decline, fall, reduction | share </B> </P> <P> <U> PREP. </U><B> ~ of </B><I>What percentage of women own a car? </I> </P> <P> <U> PHRASES </U><B> in percentage terms </B><I>The numbers are relatively low in percentage terms. </I><B>| on a percentage basis </B><I>The artist's agent receives commission on a percentage basis. </I> </P> ";"noun"
351;"sufficient";"";"<P> <U> VERBS </U> </P> <P> <U> ADV. </U> </P> <P> <U> PREP. </U> </P> ";"<P> <U> VERBS </U><B> be, prove, seem, sound | consider sth, deem sth, regard sth as, see sth as </B><I>Do you really regard that explanation as sufficient? </I> </P> <P> <U> ADV. </U><B> quite | far from | barely, hardly, scarcely </B><I>Our budget is scarcely sufficient to pay people, let alone buy any new equipment. </I><B>| just | almost </B> </P> <P> <U> PREP. </U><B> for </B><I>The salary proved sufficient for his needs. </I> </P> ";"adj."
352;"substantial";"";"";"";""
353;"explanation";"";"<P> <U> ADJ. </U> </P> <P> <U> VERB + EXPLANATION </U> </P> <P> <U> EXPLANATION + VERB </U> </P> <P> <U> PREP. </U> </P> <P> <U> PHRASES </U> </P> ";"<P> <U> ADJ. </U><B> convincing, credible, good, likely, logical, natural, obvious, plausible, probable, rational </B><I>The most likely explanation is that his plane was delayed. </I><B>| implausible, inadequate, unlikely | acceptable, adequate,  reasonable, satisfactory, sufficient | no apparent </B><I>There was no apparent explanation for the attack. </I><B>| clear, coherent | complete, comprehensive, detailed, full | partial | complex, complicated | easy, simple | innocent, prosaic </B><I>There's sure to be a perfectly innocent explanation for all this?though I admit it looks bizarre. </I><B>| convenient | accepted, traditional </B><I>There is no generally accepted explanation of this practice. </I><B>| official | possible </B> | correct, real, true | brief | <B>lengthy, long | verbal | general | common </B><I>the common explanations for hooliganism </I><B>|  only, sole </B><I>It's the only explanation that makes any kind of sense. </I><B>| causal </B><I>The causal explanation must be that old age causes poverty, not that poverty causes people to be old. </I><B>| ad hoc,  post hoc </B><I>post hoc </I>(= after the event) </B><I>explanations of historical changes that would have made no sense to anyone living at the time </I> <B>| cultural, historical, political, psychological, scientific, sociological, technical, theoretical </B> </P> <P> <U> VERB + EXPLANATION </U><B> have </B><I>I had no explanation for her strange behaviour. </I><B>| give (sb), offer (sb), provide (sb with) </B><I>He only offered a partial explanation for his lateness. </I><B>| enter into, go into, launch into </B><I>She launched into a detailed explanation of every aspect of her work. </I><B>| advance, propose, put forward </B><I>one explanation advanced by Marxist historians </I><B>| call for, need, require </B><I>An explanation is clearly called for. </I><B>| look for, seek | find, think of </B><I>I can think of one possible explanation for her behaviour. </I><B>| ask for, demand </B><I>She wrote to the company demanding an explanation. </I><B>| wait for | deserve, merit </B><I>I suppose you deserve an explanation. </I><B>| owe sb </B><I>I think you owe me an explanation. </I><B>| accept | defy </B><I>Her success has been so remarkable as to defy explanation. </I> </P> <P> <U> EXPLANATION + VERB </U><B> lie </B><I>The simplest explanation for his achievements lies in his greater ability and superiority over his contemporaries at university. </I><B>| emerge, occur to sb, present itself, suggest itself </B><I>No single clear explanation emerged from the experiments. A more credible explanation now occurred to her. Another quite plausible explanation presented itself. </I> </P> <P> <U> PREP. </U><B> in ~ </B><I>&lsquo;I've worked with them before, you see,&rsquo; he added, in explanation. </I><B>| without ~ </B><I>She left suddenly and without explanation. </I> <B>| ~ about </B><I>He entered into a technical explanation about software and programming. </I><B>| ~ as to </B><I>He provided no explanation as to why he was late. </I><B>| ~ for </B><I>There is probably some perfectly logical explanation for their behaviour. </I><B>| ~ from </B><I>We are still waiting for a full explanation from the teacher concerned. </I> </P> <P> <U> PHRASES </U><B> an attempt at explanation </B><I>The men left quickly with no attempt at explanation. </I><B>| by way of explanation </B><I>&lsquo;I had to see you, &rsquo; he said, by way of explanation. </I> </P> ";"noun"
354;"emotional";"";"<P> <U> VERBS </U> </P> <P> <U> ADV. </U> </P> <P> <U> PREP. </U> </P> <P> <U> PHRASES </U> </P> ";"<P> <U> VERBS </U><B> be, feel, look, sound | become, get, grow </B><I>He got quite emotional during the speech. </I><B>| make sb </B><I>Having all her friends around her made her very emotional. </I> </P> <P> <U> ADV. </U><B> deeply, extremely, highly, very | quite, rather </B> </P> <P> <U> PREP. </U><B> about </B><I>Don't be so emotional about everything! </I> </P> <P> <U> PHRASES </U><B> in an emotional state </B><I>He was in a very emotional state. </I> </P> ";"adj."
355;"preference";"";"<P> <U> ADJ. </U> </P> <P> <U> VERB + PREFERENCE </U> </P> <P> <U> PREP. </U> </P> <P> <U> PHRASES </U> </P> ";"<P> <U> ADJ. </U><B> clear, definite, marked, strong | slight | individual, personal </B><I>It's a matter of personal preference. </I><B>| consumer | first, second, etc. </B><I>Local voters gave Harry West first preference. </I> </P> <P> <U> VERB + PREFERENCE </U><B> have </B><I>Do you have any particular preference? </I><B>| demonstrate | express, indicate, show, state | give sb </B><I>Preference is given to students who have passed maths and chemistry. </I><B>| receive </B> </P> <P> <U> PREP. </U><B> for ~ </B><I>I choose motorways when driving, for preference. </I><B>| in ~ to </B><I>They bought French planes in preference to British ones. </I><B>| ~ as to/with regard to </B><I>He has not expressed a preference as to which school he wants to go to. </I><B>| ~ between </B><I>people's preferences between brown, white and wholemeal bread </I><B>| ~ for sth (over sth) </B><I>the government's preference for tax cuts over greater public spending </I><B>| ~ in </B><I>changing preferences in furniture styles </I> </P> <P> <U> PHRASES </U><B> in order of preference </B><I>List the candidates in order of preference. </I> </P> ";"noun"
