269.1.2;"demand";"need/desire for goods/services";"<P> <U> ADJ. </U> </P> <P> <U> QUANT. </U> </P> <P> <U> VERB + DEMAND </U> </P> <P> <U> DEMAND + VERB </U> </P> <P> <U> PREP. </U> </P> <P> <U> PHRASES </U> </P> ";"<P> <U> ADJ. </U><B> big, buoyant, considerable, enormous, great, heavy, high, huge, insatiable, peak, strong, unprecedented </B><I>Demand for the product is buoyant. There's always a great demand for our soups in winter. </I><B>| burgeoning, growing, increased/increasing, rising | excess, extra | constant, steady </B><I>She is in constant demand to make public appearances and give interviews. </I><B>| changing, fluctuating, seasonal | current, future | latent, likely, pent-up, potential, projected, prospective | overall, total </B><I>We can estimate that total market demand for electrical goods will rise by 8%. </I><B>| declining, falling, limited, low, reduced, sluggish | consumer, customer, market, popular, public </B><I>By popular demand, the play will run for another week. </I><B>| domestic, export, foreign, local, world, worldwide </B><I>The slowdown in domestic demand was offset by an increase in exports. </I><B>| electricity, energy, housing, labour, etc. </B> </P> <P> <U> QUANT. </U><B> level </B><I>a high level of demand </I> </P> <P> <U> VERB + DEMAND </U><B> cope with, meet, satisfy </B><I>The factories are staying open all weekend to try to meet the consumer demand for this product. </I><B>| create, generate </B><I>It is the job of the marketing manager to create demand for the new product. </I><B>| boost, increase, stimulate | reduce | exceed, outstrip </B><I>Supply normally exceeds demand for the bulk of consumer goods. </I><B>| forecast </B><I>It can be difficult to forecast demand in the construction industry. </I><B>| manage </B><I>policies aimed at managing demand </I> </P> <P> <U> DEMAND + VERB </U><B> grow, increase, rise </B><I>Demand for personal computers has risen sharply. </I><B>| decline, fall, slow (down) </B><I>As demand slows, the need to export will return. </I> </P> <P> <U> PREP. </U><B> in ~ </B><I>These old machines are still in demand. </I><B>| ~ among </B><I>the potential demand among children </I><B>| ~ for </B><I>increased demand for health products </I><B>| ~ from </B><I>the demand from consumers </I><B>| ~ on </B><I>This section of the population makes a high demand on health care resources. </I> </P> <P> <U> PHRASES </U><B> supply and demand </B><I>the law of supply and demand </I> &gt; Special page at BUSINESS </P> ";"noun"
269.1.3;"demand";"demands: difficult/tiring things you have to do ";"<P> <U> ADJ. </U> </P> <P> <U> VERB + DEMAND </U> </P> <P> <U> PREP. </U> </P> ";"<P> <U> ADJ. </U><B> considerable, enormous, excessive, extra, great, heavy, high, impossible </B><I>I think the demands of this job are excessive. </I><B>| exacting, pressing | growing, increasing | competing, conflicting, contradictory | day-to-day, everyday </B><I>the day-to-day demands of the job </I><B>| immediate </B><I>the need for scientific research freed from the immediate demands of industry </I><B>| external </B><I>The person who cannot say &lsquo;no&rsquo; to others' requests is likely to be overwhelmed by external demands. </I><B>| economic, emotional, financial, physical, practical, sexual, social, technical </B><I>Life is hard for nurses on children's wards, where the emotional demands can be overwhelming. </I> </P> <P> <U> VERB + DEMAND </U><B> impose, make, place </B><I>My elderly parents make a lot of demands on me. </I><B>| respond to | cope with </B><I>coping with the conflicting demands of work and family life </I> </P> <P> <U> PREP. </U><B> ~ on/upon </B><I>My work seems to make more and more demands on my time. </I> </P> ";"noun"
269.2;"demand";"";"<P> <U> ADJ. </U> </P> <P> <U> VERB + DEMAND </U> </P> <P> <U> PREP. </U> </P> <P> <U> ADJ. </U> </P> <P> <U> QUANT. </U> </P> <P> <U> VERB + DEMAND </U> </P> <P> <U> DEMAND + VERB </U> </P> <P> <U> PREP. </U> </P> <P> <U> PHRASES </U> </P> <P> <U> ADJ. </U> </P> <P> <U> VERB + DEMAND </U> </P> <P> <U> PREP. </U> </P> <P> <U> ADV. </U> </P> <P> <U> PREP. </U> </P> ";"<P> <U> ADV. </U><B> aggressively, angrily, coldly, fiercely, furiously, harshly, indignantly, irritably, roughly, sharply </B><I>&lsquo;Where are the keys?&rsquo; she demanded angrily. </I> </P> <P> <U> PREP. </U><B> from </B><I>He had demanded money from her. </I><B>| of </B><I>They failed to provide the information demanded of them. </I> </P> ";"verb"
270.1;"vision";"ability to see </B>";"<P> <U> ADJ. </U> </P> <P> <U> VERB + VISION </U> </P> <P> <U> VISION + VERB </U> </P> <P> <U> PREP. </U> </P> <P> <U> PHRASES </U> </P> ";"<P> <U> ADJ. </U><B> 20/20, excellent, perfect </B><I>The eye test shows she has perfect vision. </I><B>| normal | clear </B><I>The rain prevented her having clear vision of the road ahead. </I><B>| blurred, defective, distorted, impaired, poor | double, tunnel </B><I>(often figurative) </I><B>| all-round </B><I>The high driving position gives excellent all-round vision. </I><B>| binocular, stereoscopic | X-ray | distance </B><I>I can read without glasses, but my distance vision is poor. </I><B>| night | peripheral </B><I>Use your peripheral vision widely when moving from place to place. </I> </P> <P> <U> VERB + VISION </U><B> have | give (sb) | obscure, restrict | blur </B><I>The tears blurred her vision. </I><B>| improve </B> </P> <P> <U> VISION + VERB </U><B> clear </B><I>Her vision cleared and she realized Niall was standing beside her. </I> </P> <P> <U> PREP. </U><B> across your ~ </B><I>A bird shot across her vision. </I> </P> <P> <U> PHRASES </U><B> your field of vision </B><I>She was aware of shapes moving across her field of vision. </I><B>| your line of vision </B><I>Someone was standing in my line of vision so I couldn't see the screen. </I> </P> ";"noun"
270.2;"vision";"picture in your imagination";"<P> <U> ADJ. </U> </P> <P> <U> VERB + VISION </U> </P> <P> <U> VISION + VERB </U> </P> <P> <U> PREP. </U> </P> ";"<P> <U> ADJ. </U><B> disturbing, dreadful, ghastly, horrible | bleak | inner, intuitive, mental, spiritual | mystic/mystical, prophetic, religious </B><I>A young girl in the village experienced a prophetic vision. </I><B>| poetic | apocalyptic </B><I>an apocalyptic vision of the end of civilization </I><B>| momentary, sudden </B> </P> <P> <U> VERB + VISION </U><B> experience, have, receive </B><I>I had visions of us getting hopelessly lost. </I><B>| conjure up </B><I>The word &lsquo;island&rsquo; conjures up a vision of a relaxing summer holiday. </I> </P> <P> <U> VISION + VERB </U><B> fade </B><I>As he approached, the vision faded and there was no one there. </I> </P> <P> <U> PREP. </U><B> in a/the ~ </B><I>The idea came to her in a vision. </I><B>| ~ of </B> </P> ";"noun"
270.3;"vision";"ability to see/plan for the future";"<P> <U> ADJ. </U> </P> <P> <U> VERB + VISION </U> </P> <P> <U> PREP. </U> </P> <P> <U> PHRASES </U> </P> ";"<P> <U> ADJ. </U><B> great | imaginative | alternative | broad, comprehensive, global, wide </B><I>The company needs to develop a global vision. </I><B>| narrow | overall | personal | clear </B><I>The engineers had a clear vision of what they wanted to achieve. </I><B>| common </B><I>They share a common vision for the development of health services. </I><B>| strategic | political | revolutionary | romantic, Utopian </B> </P> <P> <U> VERB + VISION </U><B> have | develop | convey, expand on/upon, outline, promote </B><I>He outlined his vision for the new economic order. </I> <B>| impose </B><I>The new leader set about imposing his vision on the party. </I><B>| share | cloud </B><I>He was determined not to let emotions cloud his vision. </I> </P> <P> <U> PREP. </U><B> of ~ </B><I>a statesman of great vision </I><B>| ~ for </B><I>a vision for the future </I><B>| ~ of </B><I>an alternative vision of society </I> </P> <P> <U> PHRASES </U><B> breadth of vision </B><I>His plans for the country's future show a remarkable breadth of vision. </I> </P>     </script> </div>   </div> <!-- main wrap --> </html> </body> ";"noun"
271;"propose";"";"<P> <U> ADV. </U> </P> <P> <U> PREP. </U> </P> <P> <U> PHRASES </U> </P> ";"<P> <U> ADV. </U><B> seriously </B><I>Are you seriously proposing that we should allow this situation to continue? </I> </P> <P> <U> PREP. </U><B> as </B><I>The measures have been proposed as a way of improving standards. </I><B>| for </B><I>He was proposed for the job of treasurer. </I> </P> <P> <U> PHRASES </U><B> originally proposed </B><I>The plan originally proposed was ruled completely unrealistic. </I> </P> ";"verb"
272;"efficiency";"";"<P> <U> ADJ. </U> </P> <P> <U> VERB + EFFICIENCY </U> </P> <P> <U> EFFICIENCY + NOUN </U> </P> <P> <U> PREP. </U> </P> ";"<P> <U> ADJ. </U><B> ruthless | great, high </B><I>attempts to achieve greater efficiency in the production process </I><B>| maximum, optimum | low | cost | energy, fuel | mental, physical | administrative, business, economic, industrial, management, operational, organizational, production, productive, technical </B> </P> <P> <U> VERB + EFFICIENCY </U><B> achieve | boost, enhance, improve, increase, maximize, promote | decrease, impair, reduce </B> </P> <P> <U> EFFICIENCY + NOUN </U><B> drive, measures </B><I>New timekeeping procedures had been introduced as part of an efficiency drive. </I><B>| gains, improvements, savings </B><I>the efficiency gains resulting from improved technology </I> </P> <P> <U> PREP. </U><B> with ~ </B><I>The uprising was put down with ruthless efficiency. </I><B>| ~ in </B><I>greater efficiency in energy use </I> </P> ";"noun"
273.1;"solution";"to a problem, difficult situation, etc.";"<P> <U> ADJ. </U> </P> <P> <U> VERB + SOLUTION </U> </P> <P> <U> PREP. </U> </P> ";"<P> <U> ADJ. </U><B> complete, comprehensive | partial | effective, good, happy, ideal, neat, optimal, perfect, real </B><I>His plan does not offer a real solution to the problem. </I><B>| acceptable | satisfactory, workable | correct, right | easy, obvious, simple | possible | feasible, practical, realistic, viable | cost-effective | creative, imaginative, ingenious | drastic, radical | early, immediate, instant, quick, speedy </B><I>The UN representative stressed the urgency of an early solution. </I><B>| final, lasting, long-term, permanent, ultimate | interim, short-term, temporary | proposed | pragmatic | compromise, negotiated | diplomatic, peaceful, political | military | technical </B> </P> <P> <U> VERB + SOLUTION </U><B> look for, seek, work towards | achieve, agree (on), arrive at, come up with, find, produce, reach, work out </B><I>attempts to find a comprehensive political solution to the crisis </I><B>| propose, put forward, suggest | adopt | offer, provide </B> </P> <P> <U> PREP. </U><B> ~ for </B><I>a quick solution for dealing with the paper shortage </I><B>| ~ to </B><I>They were seeking an ultimate solution to the city's traffic problem. </I> </P> ";"noun"
273.2;"solution";"liquid in which a solid has been dissolved";"<P> <U> ADJ. </U> </P> <P> <U> SOLUTION + VERB </U> </P> <P> <U> PREP. </U> </P> ";"<P> <U> ADJ. </U><B> concentrated, neat, strong | dilute, weak | saturated | acid | alkaline | aqueous | saline, salt | bicarbonate, sodium chloride, etc. </B> </P> <P> <U> SOLUTION + VERB </U><B> contain </B> </P> <P> <U> PREP. </U><B> in ~ </B><I>aluminium ions in solution </I> </P>     </script> </div>   </div> <!-- main wrap --> </html> </body> ";"noun"
274;"multiple";"";"";"";""
275.1;"conclusion";"opinion reached after considering the facts";"<P> <U> ADJ. </U> </P> <P> <U> VERB + CONCLUSION </U> </P> ";"<P> <U> ADJ. </U><B> correct | logical, reasonable, valid | inescapable, inevitable, obvious | erroneous, false, wrong | main | hasty </B> </P> <P> <U> VERB + CONCLUSION </U><B> arrive at, come to, draw, reach </B><I>I can't draw any conclusions from what she said. </I><B>| jump to, leap to </B><I>We don't want to jump to the wrong conclusion. Don't go jumping to conclusions before you know the facts. </I><B>| lead to, point to </B><I>It all points to the conclusion that nobody knew what was going on. </I> </P> ";"noun"
275.2;"conclusion";"ending of sth";"<P> <U> ADJ. </U> </P> <P> <U> VERB + CONCLUSION </U> </P> <P> <U> PREP. </U> </P> ";"<P> <U> ADJ. </U><B> satisfactory, successful | foregone </B><I>The result of the match was a foregone conclusion. </I><B>| hasty </B> </P> <P> <U> VERB + CONCLUSION </U><B> bring about, bring sth to </B><I>The meeting was brought to a hasty conclusion. </I><B>| come to </B> </P> <P> <U> PREP. </U><B> in ~ </B><I>In conclusion, I would like to thank you all for your hard work. </I>&gt; Special page at MEETING </B> </P>     </script> </div>   </div> <!-- main wrap --> </html> </body> ";"noun"
276;"overall";"";"";"";""
277.1;"presence";"being present";"<P> <U> ADJ. </U> </P> <P> <U> VERB + PRESENCE </U> </P> <P> <U> PREP. </U> </P> <P> <U> PHRASES </U> </P> ";"<P> <U> ADJ. </U><B> mere </B><I>The mere presence of children in the room is enough to upset him. </I><B>| constant, continued, continuing, permanent | strong </B><I>The company now has a strong presence in Germany. </I> </P> <P> <U> VERB + PRESENCE </U><B> indicate, reveal, show </B><I>These chemicals could indicate the presence of water on the planet. </I><B>| acknowledge </B><I>He acknowledged our presence with a nod of his head. </I><B>| detect | grace sb with </B><I>(ironic or humorous) How nice of you to grace us with your presence! </I> </P> <P> <U> PREP. </U><B> in sb's ~ </B><I>He should never have made those remarks in your presence. </I> </P> <P> <U> PHRASES </U><B> make your presence felt/known </B><I>She certainly made her presence felt in the boardroom. </I> </P> ";"noun"
277.2;"presence";"number of people";"<P> <U> ADJ. </U> </P> <P> <U> VERB + PRESENCE </U> </P> ";"<P> <U> ADJ. </U><B> constant | military, police </B><I>There was a strong police presence throughout the demonstration. </I> </P> <P> <U> VERB + PRESENCE </U><B> maintain </B><I>The army maintains a constant presence in the area. </I> </P> ";"noun"
277.3;"presence";"force of personality";"<P> <U> ADJ. </U> </P> <P> <U> VERB + PRESENCE </U> </P> ";"<P> <U> ADJ. </U><B> charismatic, commanding, formidable, great, imposing, powerful, strong | stage </B><I>He had a formidable stage presence. </I> </P> <P> <U> VERB + PRESENCE </U><B> have</B> </P>     </script> </div>   </div> <!-- main wrap --> </html> </body> ";"noun"
278.1;"claim";"";"<P> <U> ADJ. </U> </P> <P> <U> VERB + CLAIM </U> </P> <P> <U> PREP. </U> </P> <P> <U> ADJ. </U> </P> <P> <U> VERB + CLAIM </U> </P> <P> <U> CLAIM + VERB </U> </P> <P> <U> CLAIM + NOUN </U> </P> <P> <U> PREP. </U> </P> <P> <U> ADJ. </U> </P> <P> <U> VERB + CLAIM </U> </P> <P> <U> PREP. </U> </P> <P> <U> ADV. </U> </P> <P> <U> VERB + CLAIM </U> </P> <P> <U> ADV. </U> </P> <P> <U> VERB + CLAIM </U> </P> <P> <U> PREP. </U> </P> ";"";"<DIV class="item"><P class="word"><B>claim </B><I>noun </I> </B> </P>"
278.2.1;"claim";"say that sth is true";"<P> <U> ADV. </U> </P> <P> <U> VERB + CLAIM </U> </P> ";"<P> <U> ADV. </U><B> justifiably, rightfully, rightly | falsely, wrongly </B><I>The company had falsely claimed that its products were biodegradable. </I> </P> <P> <U> VERB + CLAIM </U><B> attempt to, try to </B><I>He tried to claim that he had acted in self-defence. </I> </P> ";"verb"
278.2.2;"claim";"ask for sth you think you have a right to have";"<P> <U> ADV. </U> </P> <P> <U> VERB + CLAIM </U> </P> <P> <U> PREP. </U> </P> ";"<P> <U> ADV. </U><B> back </B><I>You can claim back some of the cost of your treatment. </I> </P> <P> <U> VERB + CLAIM </U><B> be able to, be entitled to, can/could </B><I>You might be entitled to claim compensation if you are injured at work. </I><B>| attempt to, try to </B> </P> <P> <U> PREP. </U><B> on </B><I>Can't you claim on your insurance? </I> </P> ";"verb"
279;"transform";"";"<P> <U> ADV. </U> </P> <P> <U> VERB + TRANSFORM </U> </P> <P> <U> PREP. </U> </P> <P> <U> PHRASES </U> </P> ";"<P> <U> ADV. </U><B> considerably, fundamentally, profoundly, radically </B><I>The riots radically transformed the situation. </I><B>| completely, entirely, totally, utterly | quickly, rapidly | gradually, slowly | suddenly | apparently | miraculously </B><I>He seems to have been miraculously transformed into a first-class player. </I><B>| overnight </B><I>Things cannot be transformed overnight. </I> </P> <P> <U> VERB + TRANSFORM </U><B> help (to) | manage to </B> </P> <P> <U> PREP. </U><B> from, into </B><I>The place was transformed from a quiet farming village into a busy port. </I> </P> <P> <U> PHRASES </U><B> the power to transform sb/sth </B><I>the power of religion to transform our hearts and minds </I> </P> ";"verb"
280;"generate";"";"<P> <U> ADV. </U> </P> <P> <U> VERB + GENERATE </U> </P> <P> <U> PREP. </U> </P> ";"<P> <U> ADV. </U><B> quickly | automatically, spontaneously </B><I>People used to believe that dirt spontaneously generated disease. </I><B>| randomly </B><I>a sequence of randomly generated fractions </I><B>| externally, internally </B><I>internally generated revenue </I><B>| locally </B> </P> <P> <U> VERB + GENERATE </U><B> help (to) </B><I>the opportunity to help generate ideas </I><B>| be used to </B><I>The wind turbines are used to generate electricity. </I><B>| be expected to, be likely to </B><I>The lottery is expected to generate substantial funds for charities. </I> </P> <P> <U> PREP. </U><B> from </B><I>Living cells generate energy from food. profits generated from the company's activities </I> </P> ";"verb"
281.1;"failure";"lack of success";"<P> <U> ADJ. </U> </P> <P> <U> VERB + FAILURE </U> </P> <P> <U> FAILURE + NOUN </U> </P> <P> <U> PHRASES </U> </P> ";"<P> <U> ADJ. </U><B> complete, total | abject, humiliating, ignominious </B><I>The attempt ended in abject failure. </I><B>| inevitable | costly | alleged, apparent, perceived | evident | comparative, relative | initial </B><I>Initial failure was followed by unexpected, if modest, success. </I><B>| ultimate </B><I>War is the ultimate failure of public communication. </I><B>| personal | moral | academic | economic, financial | military </B> </P> <P> <U> VERB + FAILURE </U><B> be doomed to, end in, result in </B><I>All her efforts were doomed to failure. </I><B>| admit, confess </B><I>He was too proud to admit failure. </I><B>| expect </B><I>Children who are doing badly tend to expect failure and criticism. </I><B>| fear | avoid </B> </P> <P> <U> FAILURE + NOUN </U><B> rate </B><I>There is a high failure rate with this treatment. </I> </P> <P> <U> PHRASES </U><B> fear of failure </B><I>Fear of failure should not deter you from trying. </I><B>| a history of failure </B><I>John had a long history of academic failure. </I><B>| a possibility/risk of failure, a sense of failure </B> </P> ";"noun"
281.2;"failure";"unsuccessful person/thing";"<P> <U> ADJ. </U> </P> <P> <U> VERB + FAILURE </U> </P> <P> <U> FAILURE + VERB </U> </P> <P> <U> PREP. </U> </P> ";"<P> <U> ADJ. </U><B> great, serious | complete, total, utter | catastrophic, disastrous | abject, conspicuous, dismal, humiliating, ignominious, lamentable, miserable | costly | heroic </B><I>Her ideas were large: if she could not succeed, she would at least be a heroic failure. </I><B>| alleged, apparent, perceived | evident | comparative, relative | past </B><I>to learn from past failures </I><B>| rare </B><I>The film was one of the rare failures in his career. </I><B>| unexpected | personal | collective | moral | academic | economic, financial </B><I>economic failure and increasing unemployment </I><B>| military </B> </P> <P> <U> VERB + FAILURE </U><B> be, represent | prove </B><I>The venture proved a costly failure. </I><B>| feel </B><I>I felt a complete failure. </I><B>| consider sb/sth, regard sb/sth as | brand sb/sth, pronounce sb/sth </B><I>Her parents had long since branded her a failure. </I> </P> <P> <U> FAILURE + VERB </U><B> arise from sth </B><I>failures arising from circumstances beyond your control </I> </P> <P> <U> PREP. </U><B> ~ of </B><I>The decision to withdraw funding represents a failure of imagination. </I> </P> ";"noun"
281.3;"failure";"not doing sth";"<P> <U> ADJ. </U> </P> <P> <U> VERB + FAILURE </U> </P> ";"<P> <U> ADJ. </U><B> fundamental | general | manifest | consistent, constant, continued/continuing, persistent, repeated | government, management </B><I>government failure to listen to the voice of the electorate </I> </P> <P> <U> VERB + FAILURE </U><B> excuse, justify </B><I>seeking to excuse his failure to ask her permission </I> </P> ";"noun"
281.4;"failure";"of a machine/system/part of the body, etc.";"<P> <U> ADJ. </U> </P> <P> <U> VERB + FAILURE </U> </P> <P> <U> FAILURE + VERB </U> </P> <P> <U> PREP. </U> </P> ";"<P> <U> ADJ. </U><B> battery, brake, component, computer, engine, equipment, mechanical, power, system, technical | bank, business, commercial, company, corporate, market </B><I>Business failures rose by 30% in 2001. </I><B>| brain, heart, kidney, liver | crop, harvest | communication </B> </P> <P> <U> VERB + FAILURE </U><B> cause, lead to, result in </B><I>a rare viral infection that can lead to heart failure </I> </P> <P> <U> FAILURE + VERB </U><B> occur </B><I>A power failure occurred between 4 and 5 p.m. </I> </P> <P> <U> PREP. </U><B> ~ in </B><I>a failure in the computer system </I> </P>     </script> </div>   </div> <!-- main wrap --> </html> </body> ";"noun"
282.1;"advance";"";"<P> <U> VERBS </U> </P> <P> <U> ADV. </U> </P> <P> <U> VERBS </U> </P> <P> <U> ADV. </U> </P> <P> <U> ADJ. </U> </P> <P> <U> VERB + ADVANCE </U> </P> <P> <U> PREP. </U> </P> <P> <U> ADJ. </U> </P> <P> <U> VERB + ADVANCE </U> </P> <P> <U> PREP. </U> </P> <P> <U> ADJ. </U> </P> <P> <U> VERB + ADVANCE </U> </P> <P> <U> PREP. </U> </P> <P> <U> ADJ. </U> </P> <P> <U> VERB + ADVANCE </U> </P> <P> <U> PREP. </U> </P> <P> <U> ADV. </U> </P> <P> <U> PREP. </U> </P> <P> <U> ADV. </U> </P> <P> <U> PREP. </U> </P> ";"";"adj."
282.2.1;"advance";"forward movement";"<P> <U> ADJ. </U> </P> <P> <U> VERB + ADVANCE </U> </P> <P> <U> PREP. </U> </P> ";"<P> <U> ADJ. </U><B> rapid | Allied, British, German, etc. </B> </P> <P> <U> VERB + ADVANCE </U><B> make </B><I>The regiment made an advance on the enemy lines. </I><B>| order </B><I>The general ordered an advance to the front line. </I><B>| halt, resist, stop </B> </P> <P> <U> PREP. </U><B> on ~ </B><I>the advance on Leningrad </I><B>| to ~, towards ~ </B><I>the Russian advance towards Berlin </I> </P> ";"noun"
282.2.2;"advance";"development";"<P> <U> ADJ. </U> </P> <P> <U> VERB + ADVANCE </U> </P> <P> <U> PREP. </U> </P> ";"<P> <U> ADJ. </U><B> big, considerable, dramatic, enormous, great, spectacular, substantial, tremendous | important, major, notable, remarkable, significant | rapid, steady </B><I>rapid advances in science and technology </I><B>| recent | economic, educational, medical, political, scientific, social, technical, technological | theoretical </B> </P> <P> <U> VERB + ADVANCE </U><B> make </B><I>We need more money if we are to make any further advances in this area of science. </I> </P> <P> <U> PREP. </U><B> in ~ </B><I>two major advances in orthopaedic medicine </I><B>| on ~ </B><I>an advance on the existing techniques </I><B>| towards ~ </B><I>an advance towards a better understanding of God </I> </P> ";"noun"
282.2.3;"advance";"money";"<P> <U> ADJ. </U> </P> <P> <U> VERB + ADVANCE </U> </P> <P> <U> PREP. </U> </P> ";"<P> <U> ADJ. </U><B> large | cash </B> </P> <P> <U> VERB + ADVANCE </U><B> give, pay </B><I>The publishers have paid me an advance. </I><B>| get, receive </B> </P> <P> <U> PREP. </U><B> ~ of </B><I>an advance of </I>&pound;</B><I>10,000 </I><B>| ~ on </B><I>He was paid </I>&pound;</B><I>5,000 as an advance on royalties. </I></P> ";"noun"
282.2.4;"advance";"advances: sexual ";"<P> <U> ADJ. </U> </P> <P> <U> VERB + ADVANCE </U> </P> <P> <U> PREP. </U> </P> ";"<P> <U> ADJ. </U><B> amorous, sexual </B> </P> <P> <U> VERB + ADVANCE </U><B> make </B><I>He made amorous advances to one of his students. </I> </P> <P> <U> PREP. </U><B> ~ to</B> </P> ";"noun"
282.3.1;"advance";"move forward";"<P> <U> ADV. </U> </P> <P> <U> PREP. </U> </P> ";"<P> <U> ADV. </U><B> quickly, rapidly | cautiously, slowly </B> </P> <P> <U> PREP. </U><B> from </B><I>advancing from the south </I><B>| into </B><I>The troops advanced into central Europe. </I><B>| on/upon </B><I>The army advanced on the capital. </I><B>| towards </B><I>He advanced towards me in aggressive style. </I> </P> ";"verb"
282.3.2;"advance";"develop";"<P> <U> ADV. </U> </P> <P> <U> PREP. </U> </P> ";"<P> <U> ADV. </U><B> considerably, greatly, significantly | rapidly </B> </P> <P> <U> PREP. </U><B> beyond </B><I>Society needs to advance beyond prejudice and superstition. </I> </P> ";"verb"
283.1;"connection";"relationship between two things";"<P> <U> ADJ. </U> </P> <P> <U> VERB + CONNECTION </U> </P> <P> <U> PREP. </U> </P> <P> <U> PHRASES </U> </P> ";"<P> <U> ADJ. </U><B> clear, close, direct, intimate, strong </B><I>There is a close connection between family background and academic achievement. </I><B>| tenuous | obvious | causal </B> </P> <P> <U> VERB + CONNECTION </U><B> have </B><I>His death had no connection with drugs. </I><B>| discover, establish, find, make, see </B><I>Researchers have now established a connection between air pollution and asthma. She did not make the connection between her diet and her poor health. </I><B>| break, sever </B><I>She wanted to sever all her connections with the firm. </I> </P> <P> <U> PREP. </U><B> in ~ with </B><I>I am writing in connection with your recent job application. </I><B>| ~ between </B><I>the connection between crime and alcohol </I><B>| ~ to/with </B><I>What is your connection with the school? </I> </P> <P> <U> PHRASES </U><B> in that/this connection </B>(= for reasons connected with sth recently mentioned)  </P> ";"noun"
