434.1.4;"display";"on a computer screen, etc.";"<P> <U> ADJ. </U> </P> <P> <U> DISPLAY + NOUN </U> </P> ";"<P> <U> ADJ. </U><B> computer, screen | data, graphics, video, visual | colour, mono/monochrome | high resolution, low resolution </B><I>a high resolution colour display </I><B>| LCD/liquid crystal | analogue, digital | Windows </B> </P> <P> <U> DISPLAY + NOUN </U><B> screen, terminal, unit </B><I>display screen equipment a visual display unit </I> </P> ";"noun"
434.2;"display";"";"<P> <U> ADJ. </U> </P> <P> <U> VERB + DISPLAY </U> </P> <P> <U> DISPLAY + VERB </U> </P> <P> <U> DISPLAY + NOUN </U> </P> <P> <U> PREP. </U> </P> <P> <U> ADJ. </U> </P> <P> <U> VERB + DISPLAY </U> </P> <P> <U> DISPLAY + NOUN </U> </P> <P> <U> PREP. </U> </P> <P> <U> ADJ. </U> </P> <P> <U> PREP. </U> </P> <P> <U> ADJ. </U> </P> <P> <U> DISPLAY + NOUN </U> </P> <P> <U> ADV. </U> </P> <P> <U> PREP. </U> </P> ";"<P> <U> ADV. </U><B> clearly, prominently </B><I>His football trophies were prominently displayed in the kitchen. </I><B>| proudly </B> </P> <P> <U> PREP. </U><B> to </B><I>She proudly displayed her degree certificate to her parents. </I> </P> ";"verb"
435.1;"publication";"of a book, etc.";"<P> <U> VERB + PUBLICATION </U> </P> <P> <U> PUBLICATION + VERB </U> </P> <P> <U> PUBLICATION + NOUN </U> </P> <P> <U> PHRASES </U> </P> ";"<P> <U> VERB + PUBLICATION </U><B> begin | cease, stop | prepare sth for | be due/scheduled for </B><I>The book is scheduled for publication in the autumn. </I><B>| accept sth for </B> </P> <P> <U> PUBLICATION + VERB </U><B> be due/scheduled </B><I>The publication of her memoirs is scheduled for the autumn. </I> </P> <P> <U> PUBLICATION + NOUN </U><B> date </B> </P> <P> <U> PHRASES </U><B> the date/time of publication </B> </P> ";"noun"
435.2;"publication";"book, magazine, etc.";"<P> <U> ADJ. </U> </P> <P> <U> PUBLICATION + NOUN </U> </P> <P> <U> PREP. </U> </P> ";"<P> <U> ADJ. </U><B> new, recent | forthcoming | leading, major | sister </B><I>&lsquo;This Week&rsquo;'s German sister publication, &lsquo;Diese Woche&rsquo;, went out of business. </I><B>| government, official | specialist | academic, business, scientific, trade </B> </P> <P> <U> PUBLICATION + NOUN </U><B> publications catalogue/list </B> </P> <P> <U> PREP. </U><B> ~ about </B><I>specialist publications about bees </I><B>| ~ on </B><I>She has several publications to her name on local history. </I> </P>     </script> </div>   </div> <!-- main wrap --> </html> </body> ";"noun"
436;"widely";"";"";"";""
437.1;"permit";"";"<P> <U> ADJ. </U> </P> <P> <U> VERB + PERMIT </U> </P> <P> <U> PERMIT + VERB </U> </P> <P> <U> PERMIT + NOUN </U> </P> <P> <U> PREP. </U> </P> <P> <U> ADV. </U> </P> <P> <U> VERB + PERMIT </U> </P> ";"<P> <U> ADJ. </U><B> government, official | export, import | residence, residency | work | travel | resident's, visitor's | building, filming, fishing, landing, parking </B> </P> <P> <U> VERB + PERMIT </U><B> have | give (sb), grant (sb), issue | get, obtain, receive | revoke | renew | apply for | need, require </B> </P> <P> <U> PERMIT + VERB </U><B> expire, run out </B> </P> <P> <U> PERMIT + NOUN </U><B> holder </B> </P> <P> <U> PREP. </U><B> by ~ </B><I>Entry is by permit only. </I><B>| with/without a ~ </B><I>You can't park here without a permit. </I><B>| ~ for </B><I>They applied for a permit for a street demonstration against university fees. </I> </P> ";"noun"
437.2;"permit";"";"<P> <U> ADJ. </U> </P> <P> <U> VERB + PERMIT </U> </P> <P> <U> PERMIT + VERB </U> </P> <P> <U> PERMIT + NOUN </U> </P> <P> <U> PREP. </U> </P> <P> <U> ADV. </U> </P> <P> <U> VERB + PERMIT </U> </P> ";"<P> <U> ADV. </U><B> legally | generally, normally </B><I>Development is not normally permitted in conservation areas. </I> </P> <P> <U> VERB + PERMIT </U><B> refuse to | be designed to </B><I>The bill was designed to permit workers to take up to twelve weeks' unpaid leave annually for family reasons. </I> </P> ";"verb"
438;"merely";"";"";"";""
439.1;"joint";"in the body";"<P> <U> ADJ. </U> </P> <P> <U> VERB + JOINT </U> </P> <P> <U> JOINT + VERB </U> </P> <P> <U> PREP. </U> </P> <P> <U> PHRASES </U> </P> ";"<P> <U> ADJ. </U><B> elbow, hip, knee, etc. | inflamed, painful, rheumatic, stiff, swollen | artificial </B> </P> <P> <U> VERB + JOINT </U><B> replace </B><I>He's going to have his hip joint replaced. </I> </P> <P> <U> JOINT + VERB </U><B> ache | move </B><I>The joint should be able to move freely. </I> </P> <P> <U> PREP. </U><B> in a/the ~ </B><I>You've got fluid in the joint. </I><B>| ~ between </B><I>the joint between the lower and upper parts of the arm </I> </P> <P> <U> PHRASES </U><B> put sth out of joint </B><I>She fell and put her knee out of joint. </I> </P> ";"noun"
439.2;"joint";"connecting point";"<P> <U> ADJ. </U> </P> <P> <U> VERB + JOINT </U> </P> <P> <U> PREP. </U> </P> ";"<P> <U> ADJ. </U><B> airtight, watertight | leaking </B> </P> <P> <U> VERB + JOINT </U><B> make, seal </B> </P> <P> <U> PREP. </U><B> ~ between </B><I>a joint between two lengths of copper </I> </P> ";"noun"
439.3;"joint";"piece of meat";"<P> <U> ADJ. </U> </P> <P> <U> VERB + JOINT </U> </P> <P> <U> PREP. </U> </P> ";"<P> <U> ADJ. </U><B> bacon </B> </P> <P> <U> VERB + JOINT </U><B> cook, roast | carve </B> </P> <P> <U> PREP. </U><B> ~ of </B><I>a joint of beef/lamb/pork </I> </P>     </script> </div>   </div> <!-- main wrap --> </html> </body> ";"noun"
440;"comprehensive";"";"<P> <U> VERBS </U> </P> <P> <U> ADV. </U> </P> ";"<P> <U> VERBS </U><B> be </B> </P> <P> <U> ADV. </U><B> extremely, very | fully, totally </B><I>fully comprehensive insurance </I><B>| increasingly | fairly, pretty, quite, reasonably </B><I>The list is fairly comprehensive. </I><B>| truly</B> </P> ";"adj."
441;"alter";"";"<P> <U> ADV. </U> </P> <P> <U> PHRASES </U> </P> ";"<P> <U> ADV. </U><B> considerably, dramatically, drastically, fundamentally, greatly, radically, significantly, substantially </B><I>He had not altered greatly in the last ten years. </I><B>| slightly </B> </P> <P> <U> PHRASES </U><B> not alter the fact that </B><I>Unemployment has come down slightly but this does not alter the fact that it is still a major problem. </I> </P> ";"verb"
442;"insight";"";"<P> <U> ADJ. </U> </P> <P> <U> QUANT. </U> </P> <P> <U> VERB + INSIGHT </U> </P> <P> <U> PREP. </U> </P> <P> <U> PHRASES </U> </P> ";"<P> <U> ADJ. </U><B> considerable, great, real, significant | deep | detailed | brief | good, remarkable </B><I>The objective of the research is to gain a better insight into labour market processes. </I><B>| penetrating, profound, revealing, illuminating | crucial, important, invaluable, valuable | useful | fascinating, interesting | startling | fresh, new | original, unique </B><I>Freud's original insights into the working of the mind </I><B>| rare | clear | basic | direct </B><I>The research will provide direct insight into molecular mechanisms. </I><B>| further | sufficient | individual, personal | critical, historical, theoretical </B> </P> <P> <U> QUANT. </U><B> flash </B><I>With a flash of insight, she found the solution to the problem. </I><B>| degree </B> </P> <P> <U> VERB + INSIGHT </U><B> have </B><I>The experienced specialist has professional skills and insight. </I><B>| be lacking in, lack | show | allow (sb), afford (sb), give (sb), offer (sb), provide (sb with), produce, yield | gain, get, obtain | apply </B><I>Teachers have to apply in the classroom the insights that they gain in educational courses. </I> </P> <P> <U> PREP. </U><B> ~ about </B><I>Schopenhauer's insight about music </I><B>| ~ into </B><I>a fresh insight into Picasso's mind </I><B>| ~ (as) to </B><I>an insight as to how the gene works </I> </P> <P> <U> PHRASES </U><B> a lack of insight</B> </P> ";"noun"
443.1;"document";"official paper/book";"<P> <U> ADJ. </U> </P> <P> <U> QUANT. </U> </P> <P> <U> VERB + DOCUMENT </U> </P> <P> <U> DOCUMENT + VERB </U> </P> <P> <U> PREP. </U> </P> <P> <U> PHRASES </U> </P> ";"<P> <U> ADJ. </U><B> important, key, seminal </B><I>one of the key documents in this case </I> | relevant | large, lengthy, long, <B>weighty | brief, short | </B> 10-page, etc. | complete, entire, <B>whole </B><I>This statement must be understood in the context of the entire document. </I><B>| summary | detailed | draft | revised | final | original </B><I>The original document has been lost or destroyed. </I><B>| electronic, paper, printed, written | published, unpublished | enclosed </B><I>Please sign the enclosed document and return it to me. </I><B>| single </B><I>A constitution need not be a single document. </I><B>| classified,  confidential, privileged </B><I>(law)</I>, <B>(top) secret | private | public | available </B><I>Documents will be available at the news conference. </I><B>| internal </B><I>details of internal UN documents </I><B>| approved, signed | unsigned | authentic, genuine | forged | disclosed, leaked |  government, legal, official | policy, strategy | travel </B><I>Keep your travel documents in a secure place. </I><B>| registration </B><I>a car's registration document </I><B>| contract, offer, tender </B><I>(all business) He has promised to post a formal offer document to shareholders by Monday. </I><B>| briefing |  consultation, consultative, discussion, proposal, working </B><I>a working document in the discussions for a final treaty </I><B>| basic, framework | guidance | supporting | (legally) binding </B><I>A document signed abroad is as legally binding as one signed at home. </I><B>| constitutional, contractual | historical </B> </P> <P> <U> QUANT. </U><B> copy </B> </P> <P> <U> VERB + DOCUMENT </U><B> draft, draw up, prepare, produce, publish, type, write </B><I>The government has produced an important new policy document. </I><B>| revise | disclose  </B><I>(law)</I>, <B>issue </B><I>a consultative document issued by the Department of Trade and Industry </I> <B>| receive | obtain | file </B><I>Copies of the relevant documents must be filed at court. </I><B>| hand over/sb,  present, submit </B><I>Supporting documents must be submitted to the supervisory authority. </I><B>| produce </B><I>He was unable to produce the document that he claimed would prove his case. </I><B>| keep | circulate, send (out) | leak </B><I>documents leaked from the government to the press </I><B>| read | go through, read through </B><I>Go through the document checking for errors. </I><B>| search through, sort through </B><I>I had to search through 4,000 documents to find the information I needed. </I><B>| consider, examine, study | accept, adopt, approve, endorse, execute </B><I>(law)</I>, sign </B><I>The conference adopted a document on minority rights. </I><B>| authenticate | forge | refer to | address | attach, enclose </B><I>The relevant documents are enclosed for your information. </I><B>| scan </B><I>Existing paper documents could be scanned into a computer. </I> </P> <P> <U> DOCUMENT + VERB </U><B> be concerned with sth, concern sth, deal with sth, focus on sth, relate to sth | contain sth, cover sth, include sth </B><I>documents covering various points of concern </I><B>| refer to sth | acknowledge sth, describe sth, detail sth, explain sth, indicate sth, list sth, note sth, outline sth, record sth, say sth, set out sth, state sth, tell sb sth </B><I>The document says they are against tax rebates. </I><B>| call for sth, propose sth, suggest sth </B><I>a document calling for a ceasefire </I><B>| aim at sth, envisage sth, seek sth </B><I>documents aimed at stimulating discussion </I><B>| reveal sth, show sth | purport sth </B><I>Documents leaked to this newspaper purport to reveal that radioactive waste is being illegally dumped on the site. </I><B>| summarize sth | confirm sth | be agreed (on/upon) </B><I>a document agreed with the District Council </I><B>| be  called sth, be entitled sth, be headed sth, be known as sth </B><I>a document entitled &lsquo;Guidelines for Good Practice&rsquo; </I><B>| be written </B><I>The document is written in Chinese. </I><B>| exist </B><I>No other genuine document exists. </I><B>| date back from/to &hellip; , <B>be dated &hellip; </B><I>documents dating back to the 1920s The document is dated 775. </I> </P> <P> <U> PREP. </U><B> according to a/the ~ </B><I>According to leaked cabinet documents, no compensation would be paid. </I><B>| in a/the ~ </B><I>He particularly criticized the terminology in the document. </I><B>| throughout a/the ~ </B><I>There is a disclaimer throughout the official documents. </I><B>| ~ about/concerning </B><I>a document concerning arbitration procedures in Cairo </I><B>| ~ of </B><I>a document of 2,000 words a document of 1999 Her journal is an important document of Victorian rural life </I><B>| ~ on </B><I>a government document on transport policy </I> </P> <P> <U> PHRASES </U><B> a draft/version of a document </B> </P> ";"noun"
443.2;"document";"computer file";"<P> <U> ADJ. </U> </P> <P> <U> VERB + DOCUMENT </U> </P> <P> <U> PREP. </U> </P> ";"<P> <U> ADJ. </U><B> active, current </B><I>Highlight </I>a </B><I>passage in the active documen</I>t </B><I>and click on the print icon. </I>| <B>printed </B> </P> <P> <U> VERB + DOCUMENT </U><B> open | close | display </B><I>to display documents o</I>n </B><I>screen </I><B>| retrieve | scroll through </B><I>Scroll through the document usin</I>g </B><I>the slider bar on the right of th</I>e </B><I>window. </I><B>| search </B><I>a software too</I>l </B><I>for searching documents an</I>d </B><I>retrieving information </I><B>| create </B><I>T</I>o </B><I>create a new document, selec</I>t </B><I>New from the File menu. </I><B>| edit | save </B><I>Save the document befor</I>e </B><I>closing. </I><B>| format | spell check | send </B><I>Send and receive document</I>s </B><I>at the click of a button. </I><B>| receive | print (out) </B> </P> <P> <U> PREP. </U><B> in a/the ~ </B><I>Cut and paste i</I>s </B><I>used to move text to a new plac</I>e </B><I>in the document</I>. &gt; Special page at COMPUTER </B> </P>     </script> </div>   </div> <!-- main wrap --> </html> </body> ";"noun"
444;"imply";"";"<P> <U> ADV. </U> </P> <P> <U> VERB + IMPLY </U> </P> <P> <U> PHRASES </U> </P> ";"<P> <U> ADV. </U><B> clearly, heavily, strongly | simply | generally, normally, usually | automatically | not necessarily </B><I>This does not necessarily imply that children achieve better results in private schools. </I><B>| in no way </B><I>They believe that submission in no way implies inferiority. </I> </P> <P> <U> VERB + IMPLY </U><B> seem to </B><I>The letter seems to imply that the minister knew about the business deals. </I><B>| intend to, mean to </B><I>I never meant to imply any criticism. </I><B>| take sth to </B><I>This statement should not be taken to imply that the government is exonerated of all blame. </I> </P> <P> <U> PHRASES </U><B> express or implied </B><I>the express or implied terms of the contract </I> </P> ";"verb"
445.1;"absence";"fact of not being present";"<P> <U> ADJ. </U> </P> <P> <U> QUANT. </U> </P> <P> <U> PREP. </U> </P> <P> <U> PHRASES </U> </P> ";"<P> <U> ADJ. </U><B> lengthy, long, prolonged | brief, temporary | unauthorized </B> </P> <P> <U> QUANT. </U><B> period, spell </B><I>You will not be paid for the full period of absence. </I> </P> <P> <U> PREP. </U><B> during/in sb's ~ </B>(= while sb is not there) <I>My father did all the cooking in my mother's absence. </I><B>| ~ from </B><I>absence from work </I> </P> <P> <U> PHRASES </U><B> conspicuous/notable by your absence </B>(= very obviously absent when you ought to be present) <I>When it came to clearing up afterwards, Anne was conspicuous by her absence. </I><B>| leave of absence </B>(= permission to be absent) <I>He asked for leave of absence from the army. </I> </P> ";"noun"
445.2;"absence";"lack";"<P> <U> ADJ. </U> </P> <P> <U> PREP. </U> </P> ";"<P> <U> ADJ. </U><B> complete, total | virtual | conspicuous, notable </B><I>a conspicuous absence of evidence </I> </P> <P> <U> PREP. </U><B> in the ~ of </B><I>In the absence of stone, most houses in the area are built of wood. </I> </P>     </script> </div>   </div> <!-- main wrap --> </html> </body> ";"noun"
446;"explicitly";"";"";"";""
447.1;"conventional";"";"<P> <U> VERBS </U> </P> <P> <U> ADV. </U> </P> <P> <U> ADJ. </U> </P> <P> <U> QUANT. </U> </P> <P> <U> VERB + CONVENTION </U> </P> <P> <U> CONVENTION + VERB </U> </P> <P> <U> PREP. </U> </P> <P> <U> PHRASES </U> </P> <P> <U> ADJ. </U> </P> <P> <U> VERB + CONVENTION </U> </P> <P> <U> CONVENTION + VERB </U> </P> <P> <U> CONVENTION + NOUN </U> </P> <P> <U> PREP. </U> </P> <P> <U> PHRASES </U> </P> <P> <U> ADJ. </U> </P> <P> <U> VERB + CONVENTION </U> </P> <P> <U> CONVENTION + VERB </U> </P> <P> <U> PREP. </U> </P> <P> <U> PHRASES </U> </P> ";"";"<DIV class="item"><P class="word"><B>conventional </B><I>adj</I> </P>"
447.2;"conventional";"";"<P> <U> VERBS </U> </P> <P> <U> ADV. </U> </P> <P> <U> ADJ. </U> </P> <P> <U> QUANT. </U> </P> <P> <U> VERB + CONVENTION </U> </P> <P> <U> CONVENTION + VERB </U> </P> <P> <U> PREP. </U> </P> <P> <U> PHRASES </U> </P> <P> <U> ADJ. </U> </P> <P> <U> VERB + CONVENTION </U> </P> <P> <U> CONVENTION + VERB </U> </P> <P> <U> CONVENTION + NOUN </U> </P> <P> <U> PREP. </U> </P> <P> <U> PHRASES </U> </P> <P> <U> ADJ. </U> </P> <P> <U> VERB + CONVENTION </U> </P> <P> <U> CONVENTION + VERB </U> </P> <P> <U> PREP. </U> </P> <P> <U> PHRASES </U> </P> ";"";"noun"
448.1;"index";"list of names/topics in a book";"<P> <U> ADJ. </U> </P> <P> <U> VERB + INDEX </U> </P> <P> <U> INDEX + VERB </U> </P> <P> <U> PREP. </U> </P> ";"<P> <U> ADJ. </U><B> comprehensive, complete | detailed | general | alphabetical </B> </P> <P> <U> VERB + INDEX </U><B> appear in, be in  </B><I>Although the book was devoted to cancer, the word &lsquo;cancer&rsquo; did not even appear in the index. </I><B>| consult, look (sth up) in </B><I>Why don't you look up her name in the index? </I><B>| compile  </B> </P> <P> <U> INDEX + VERB </U><B> give sth, list sth </B><I>The index only gives the main towns. </I> </P> <P> <U> PREP. </U><B> in a/the ~ </B><I>Is there any reference to it in the index? </I><B>| ~ to  </B><I>It's a general index to the whole work. </I> </P> ";"<DIV class="item"><P class="word"><B>index </B><I>noun </I> </B> </P>"
448.2;"index";"ordered record of books/files";"<P> <U> ADJ. </U> </P> <P> <U> VERB + INDEX </U> </P> <P> <U> INDEX + NOUN </U> </P> <P> <U> PREP. </U> </P> ";"<P> <U> ADJ. </U><B> subject, title | card | computer, computerized </B> </P> <P> <U> VERB + INDEX </U><B> have, keep </B><I>We keep a card index of all the titles on the shelves. </I><B>| compile, create | consult, look (sth up) in, search </B><I>Look up &lsquo;The Waste Land&rsquo; in the index. Search the index to find the address of the data file. </I> </P> <P> <U> INDEX + NOUN </U><B> card </B> </P> <P> <U> PREP. </U><B> in a/the ~ </B><I>cards in a card index </I> </P> ";"<DIV class="item"><P class="word"><B>index </B><I>noun </I> </B> </P>"
448.3;"index";"system showing the level of sth; measure of sth";"<P> <U> ADJ. </U> </P> <P> <U> VERB + INDEX </U> </P> <P> <U> INDEX + VERB </U> </P> <P> <U> PREP. </U> </P> <P> <U> PHRASES </U> </P> ";"<P> <U> ADJ. </U><B> good, reliable, sensitive | high | low | weighted | official | general </B><I>a general index calculated from death and population information </I><B>| world </B><I>The world index fell 3.1%. </I><B>| cost-of-living, market, retail price | futures, share, stock | Dow Jones, FT-SE 100, etc. </B> </P> <P> <U> VERB + INDEX </U><B> have </B><I>Those who lived in the inner cities had a high index of deprivation. </I><B>| use (sth as) </B><I>The test results were used as an index of language proficiency. </I><B>| compile, construct, create | calculate, compute </B><I>The index was calculated with a computer. </I><B>| publish </B><I>The retail price index is published monthly. </I><B>| drag, drive, push, take </B><I>A wave of frenzied buying pushed the index up 136.2 points. </I> </P> <P> <U> INDEX + VERB </U><B> measure sth </B><I>an index designed to measure monthly changes in the volume of industrial production </I><B>| be based on sth </B><I>an index based on incidents causing a loss of production </I><B>| be linked to sth </B><I>The increase in our standard rates will be linked to the retail price index. </I><B>| cover sth </B><I>an index covering some 1,700 companies </I><B>| open | close, end </B><I>The hundred shares index closed down 15 points. </I> </P> <P> <U> PREP. </U><B> in an/the ~ </B><I>dividends on shares in the index </I><B>| on an/the ~ </B><I>people dealing in options on the FT-SE 100 index </I> </P> <P> <U> PHRASES </U><B> a drop/fall in an index </B><I>a 28.2 point drop in the FT-SE 100 index </I><B>| changes in an index, an increase in an index, as measured by an index </B><I>Inflation, as measured by the retail price index, is expected to drop. </I>      <br><a href="#" class="show_hide" id="plus">More information about PER CENT</a>  <DIV class="slidingDiv"> <a><I>FINANCIAL:</I></a>  <P><B>indicators ~ be down/up </B><I>With the share price down at 234p, it might be time to start buying. The CAC index was up 18.84 points. </I></P> <P><B>~ reach sth, stand at sth </B><I>Consumer confidence reached a 30-year high. Second quarter sales stood at &pound; 18 billion. </I></P> <P><B>~ be/remain unchanged </B><I>The 100 Share Index remained unchanged at 5297. </I></P> <P><B>~ gain (sth) </B><I>The share gained 19 cents to close at 4.38. </I></P> <P><B>~ suffer (sth) </B><I>Profit margins suffered when the company lowered prices to remain competitive. </I></P> <P><B>~ climb, edge up, go up, increase ( ~ increase in value </B>for currencies<B>), jump, rise, rocket, shoot up, skyrocket, soar (</B>+ <I>by, from, to or no preposition</I><B>) </B><I>Earnings per share climbed from 3.5p to 5.1p. The pound has increased in value relative to the euro. Profits have shot up by a staggering 25%. Oil prices have skyrocketed. </I></P> <P><B>~ come/go down, crash, decline, decrease ( ~ decrease in value </B>for currencies<B>), dive, drop, fall, plummet, plunge, shrink, slip, slump (</B>+ <I>by, from, to or no preposition</I><B>) </B><I>Banana exports crashed nearly 50%. The pound fell to a 14-year low against the dollar. Net income plummeted to USD 3.7 million. </I></P>  <P></P> </DIV>      </P>     </script> </div>   </div> <!-- main wrap --> </html> </body> ";"<DIV class="item"><P class="word"><B>index </B><I>noun </I> </B> </P>"
449;"nevertheless";"";"";"";""
450;"facilitate";"";"<P> <U> ADV. </U> </P> <P> <U> VERB + FACILITATE </U> </P> ";"<P> <U> ADV. </U><B> greatly </B><I>The use of computers has greatly facilitated the firm's ability to keep accurate records. </I><B>| further </B> </P> <P> <U> VERB + FACILITATE </U><B> be designed to, help (to)</B> </P> ";"verb"
451;"evolution";"";"<P> <U> ADJ. </U> </P> <P> <U> VERB + EVOLUTION </U> </P> <P> <U> EVOLUTION + VERB </U> </P> <P> <U> PREP. </U> </P> <P> <U> PHRASES </U> </P> ";"<P> <U> ADJ. </U><B> gradual | rapid | continuous | natural | peaceful </B><I>the peaceful evolution to democracy </I><B>| biological, cultural, historical, political, social, technological | animal, human | Darwinian </B> </P> <P> <U> VERB + EVOLUTION </U><B> trace </B><I>a book tracing the evolution of the English language </I> </P> <P> <U> EVOLUTION + VERB </U><B> occur, proceed, take place </B><I>Evolution proceeds by a series of small changes. </I> </P> <P> <U> PREP. </U><B> ~ from &hellip; to &hellip; </B><I>his evolution from comedian to serious actor </I><B>| ~ towards </B><I>the country's gradual evolution towards democracy </I> </P> <P> <U> PHRASES </U><B> the theory of evolution </B><I>people who reject the theory of evolution </I> </P> ";"noun"
452;"intellectual";"";"";"";""
453;"govern";"";"<P> <U> ADV. </U> </P> <P> <U> VERB + GOVERN </U> </P> ";"<P> <U> ADV. </U><B> well | directly </B><I>The colony was governed directly from Paris. </I> </P> <P> <U> VERB + GOVERN </U><B> be fit/unfit to </B><I>He accused the opposition party of being unfit to govern. </I> </P> ";"verb"
454.1.1;"signal";"sign/action/sound that sends a </B>message";"<P> <U> ADJ. </U> </P> <P> <U> VERB + SIGNAL </U> </P> <P> <U> SIGNAL + VERB </U> </P> <P> <U> PREP. </U> </P> ";"<P> <U> ADJ. </U><B> clear, unmistakable | agreed,  pre-arranged | conflicting, confusing, contradictory, mixed | wrong </B><I>Laughing when you should be crying sends out the wrong signals to people. </I><B>| alarm, danger, distress, warning | hand, non-verbal, semaphore, smoke, verbal, visual </B> </P> <P> <U> VERB + SIGNAL </U><B> arrange </B><I>He had arranged a signal for the band to begin. </I><B>| give (sb), make, send (out) </B><I>When I give the signal, run! </I> <B>| interpret (sth as), read, see sth as </B><I>The remark was seen as a signal that their government was ready to return to the peace talks. </I> <B>| pick up, respond to </B><I>Interviewers quickly learn to pick up non-verbal signals. </I><B>| act as </B><I>The insect's bright colours act as warning signals to its predators. </I> </P> <P> <U> SIGNAL + VERB </U><B> come from sth </B><I>trying to read the signals coming from the patient </I><B>| indicate sth </B><I>the signals that can indicate danger </I> </P> <P> <U> PREP. </U><B> at/on a ~ </B><I>At a pre-arranged signal, everyone started cheering. </I> <B>| ~ for </B><I>She made a signal for the car to stop. </I><B>| ~ from/to </B><I>Wait for the signal from the leader of your group. </I> </P> ";"noun"
454.1.2;"signal";"set of lights for drivers";"<P> <U> ADJ. </U> </P> <P> <U> VERB + SIGNAL </U> </P> <P> <U> SIGNAL + VERB </U> </P> <P> <U> SIGNAL + NOUN </U> </P> ";"<P> <U> ADJ. </U><B> railway, traffic </B> </P> <P> <U> VERB + SIGNAL </U><B> operate </B> </P> <P> <U> SIGNAL + VERB </U><B> be (on) red/green </B><I>The traffic signals were on red. </I><B>| fail </B> </P> <P> <U> SIGNAL + NOUN </U><B> box | failure </B> </P> ";"noun"
